[
  {
    "dateRange": "Jul 17th to Jul 23rd 2023",
    "startDateFormatted": "17/07/2023",
    "endDateFormatted": "23/07/2023",
    "startDate": "2023-07-17T00:00:00.000Z",
    "endDate": "2023-07-23T00:00:00.000Z",
    "tweet": "",
    "land": [
      {
        "temtem": "Hoglip",
        "areas": [
          "Caves"
        ],
        "ratePercent": 70,
        "lumaRate": 3,
        "minSvs": 0,
        "eggTechPercent": 20
      }
    ],
    "water": [
      {
        "temtem": "Nessla",
        "areas": [
          "Water"
        ],
        "ratePercent": 70,
        "lumaRate": 2,
        "minSvs": 0,
        "eggTechPercent": 19
      }
    ]
  },
  {
    "dateRange": "Jul 10th to Jul 16th 2023",
    "startDateFormatted": "10/07/2023",
    "endDateFormatted": "16/07/2023",
    "startDate": "2023-07-10T00:00:00.000Z",
    "endDate": "2023-07-16T00:00:00.000Z",
    "tweet": "",
    "land": [
      {
        "temtem": "Banapi",
        "areas": [
          "Caves"
        ],
        "ratePercent": 75,
        "lumaRate": 1,
        "minSvs": 35,
        "eggTechPercent": 17
      },
      {
        "temtem": "Akranox",
        "areas": [
          "Fields"
        ],
        "ratePercent": 90,
        "lumaRate": 1,
        "minSvs": 32,
        "eggTechPercent": 14
      }
    ],
    "water": []
  },
  {
    "dateRange": "Jul 3rd to Jul 9th 2023",
    "startDateFormatted": "03/07/2023",
    "endDateFormatted": "09/07/2023",
    "startDate": "2023-07-03T00:00:00.000Z",
    "endDate": "2023-07-09T00:00:00.000Z",
    "tweet": "",
    "land": [
      {
        "temtem": "Swali",
        "areas": [
          "Fields"
        ],
        "ratePercent": 80,
        "lumaRate": 4,
        "minSvs": 0,
        "eggTechPercent": 17
      },
      {
        "temtem": "Blooze",
        "areas": [
          "Caves"
        ],
        "ratePercent": 60,
        "lumaRate": 3,
        "minSvs": 0,
        "eggTechPercent": 15
      }
    ],
    "water": []
  },
  {
    "dateRange": "Jun 26th to Jul 2nd 2023",
    "startDateFormatted": "26/06/2023",
    "endDateFormatted": "02/07/2023",
    "startDate": "2023-06-26T00:00:00.000Z",
    "endDate": "2023-07-02T00:00:00.000Z",
    "tweet": "",
    "land": [
      {
        "temtem": "Gorong",
        "areas": [
          "Fields"
        ],
        "ratePercent": 95,
        "lumaRate": 1,
        "minSvs": 31,
        "eggTechPercent": 7
      }
    ],
    "water": [
      {
        "temtem": "Droply",
        "areas": [
          "Water"
        ],
        "ratePercent": 100,
        "lumaRate": 1,
        "minSvs": 36,
        "eggTechPercent": 15
      }
    ]
  },
  {
    "dateRange": "Jun 19th to Jun 25th 2023",
    "startDateFormatted": "19/06/2023",
    "endDateFormatted": "25/06/2023",
    "startDate": "2023-06-19T00:00:00.000Z",
    "endDate": "2023-06-25T00:00:00.000Z",
    "tweet": "",
    "land": [
      {
        "temtem": "Skail",
        "areas": [
          "Caves"
        ],
        "ratePercent": 100,
        "lumaRate": 3,
        "minSvs": 0,
        "eggTechPercent": 16
      },
      {
        "temtem": "Saipat",
        "areas": [
          "Fields"
        ],
        "ratePercent": 100,
        "lumaRate": 4,
        "minSvs": 0,
        "eggTechPercent": 14
      }
    ],
    "water": []
  },
  {
    "dateRange": "Jun 12th to Jun 18th 2023",
    "startDateFormatted": "12/06/2023",
    "endDateFormatted": "18/06/2023",
    "startDate": "2023-06-12T00:00:00.000Z",
    "endDate": "2023-06-18T00:00:00.000Z",
    "tweet": "",
    "land": [
      {
        "temtem": "Halzhi",
        "areas": [
          "Fields"
        ],
        "ratePercent": 65,
        "lumaRate": 1,
        "minSvs": 37,
        "eggTechPercent": 5
      },
      {
        "temtem": "Vulvir",
        "areas": [
          "Caves"
        ],
        "ratePercent": 95,
        "lumaRate": 1,
        "minSvs": 32,
        "eggTechPercent": 16
      }
    ],
    "water": []
  },
  {
    "dateRange": "Jun 5th to Jun 11th 2023",
    "startDateFormatted": "05/06/2023",
    "endDateFormatted": "11/06/2023",
    "startDate": "2023-06-05T00:00:00.000Z",
    "endDate": "2023-06-11T00:00:00.000Z",
    "tweet": "",
    "land": [
      {
        "temtem": "Broccoblin",
        "areas": [
          "Caves"
        ],
        "ratePercent": 100,
        "lumaRate": 3,
        "minSvs": 0,
        "eggTechPercent": 16
      }
    ],
    "water": [
      {
        "temtem": "Fomu",
        "areas": [
          "Water"
        ],
        "ratePercent": 100,
        "lumaRate": 4,
        "minSvs": 0,
        "eggTechPercent": 11
      }
    ]
  },
  {
    "dateRange": "May 29th to Jun 4th 2023",
    "startDateFormatted": "29/05/2023",
    "endDateFormatted": "04/06/2023",
    "startDate": "2023-05-29T00:00:00.000Z",
    "endDate": "2023-06-04T00:00:00.000Z",
    "tweet": "",
    "land": [
      {
        "temtem": "Mosu",
        "areas": [
          "Fields"
        ],
        "ratePercent": 95,
        "lumaRate": 1,
        "minSvs": 30,
        "eggTechPercent": 15
      },
      {
        "temtem": "Reval",
        "areas": [
          "Hills"
        ],
        "ratePercent": 95,
        "lumaRate": 1,
        "minSvs": 30,
        "eggTechPercent": 8
      }
    ],
    "water": []
  },
  {
    "dateRange": "May 22nd to May 28th 2023",
    "startDateFormatted": "22/05/2023",
    "endDateFormatted": "28/05/2023",
    "startDate": "2023-05-22T00:00:00.000Z",
    "endDate": "2023-05-28T00:00:00.000Z",
    "tweet": "",
    "land": [
      {
        "temtem": "Mushi",
        "areas": [
          "Caves"
        ],
        "ratePercent": 90,
        "lumaRate": 3,
        "minSvs": 0,
        "eggTechPercent": 13
      },
      {
        "temtem": "Tateru",
        "areas": [
          "Fields"
        ],
        "ratePercent": 100,
        "lumaRate": 3,
        "minSvs": 0,
        "eggTechPercent": 20
      }
    ],
    "water": []
  },
  {
    "dateRange": "May 15th to May 21st 2023",
    "startDateFormatted": "15/05/2023",
    "endDateFormatted": "21/05/2023",
    "startDate": "2023-05-15T00:00:00.000Z",
    "endDate": "2023-05-21T00:00:00.000Z",
    "tweet": "",
    "land": [
      {
        "temtem": "Occlura",
        "areas": [
          "Caves"
        ],
        "ratePercent": 60,
        "lumaRate": 1,
        "minSvs": 38,
        "eggTechPercent": 11
      },
      {
        "temtem": "Momo",
        "areas": [
          "Fields"
        ],
        "ratePercent": 50,
        "lumaRate": 1,
        "minSvs": 35,
        "eggTechPercent": 11
      }
    ],
    "water": []
  },
  {
    "dateRange": "May 8th to May 14th 2023",
    "startDateFormatted": "08/05/2023",
    "endDateFormatted": "14/05/2023",
    "startDate": "2023-05-08T00:00:00.000Z",
    "endDate": "2023-05-14T00:00:00.000Z",
    "tweet": "",
    "land": [
      {
        "temtem": "Maoala",
        "areas": [
          "Caves"
        ],
        "ratePercent": 100,
        "lumaRate": 4,
        "minSvs": 0,
        "eggTechPercent": 17
      },
      {
        "temtem": "Adoroboros",
        "areas": [
          "Fields"
        ],
        "ratePercent": 65,
        "lumaRate": 3,
        "minSvs": 0,
        "eggTechPercent": 10
      }
    ],
    "water": []
  },
  {
    "dateRange": "May 1st to May 7th 2023",
    "startDateFormatted": "01/05/2023",
    "endDateFormatted": "07/05/2023",
    "startDate": "2023-05-01T00:00:00.000Z",
    "endDate": "2023-05-07T00:00:00.000Z",
    "tweet": "",
    "land": [
      {
        "temtem": "Orphyll",
        "areas": [
          "Caves"
        ],
        "ratePercent": 80,
        "lumaRate": 1,
        "minSvs": 37,
        "eggTechPercent": 7
      },
      {
        "temtem": "Kuri",
        "areas": [
          "Fields"
        ],
        "ratePercent": 80,
        "lumaRate": 1,
        "minSvs": 34,
        "eggTechPercent": 19
      }
    ],
    "water": []
  },
  {
    "dateRange": "Apr 24th to Apr 30th 2023",
    "startDateFormatted": "24/04/2023",
    "endDateFormatted": "30/04/2023",
    "startDate": "2023-04-24T00:00:00.000Z",
    "endDate": "2023-04-30T00:00:00.000Z",
    "tweet": "",
    "land": [
      {
        "temtem": "Ampling",
        "areas": [
          "Hills"
        ],
        "ratePercent": 85,
        "lumaRate": 4,
        "minSvs": 0,
        "eggTechPercent": 15
      },
      {
        "temtem": "0b1",
        "areas": [
          "Fields"
        ],
        "ratePercent": 75,
        "lumaRate": 4,
        "minSvs": 0,
        "eggTechPercent": 13
      }
    ],
    "water": []
  },
  {
    "dateRange": "Apr 17th to Apr 23rd 2023",
    "startDateFormatted": "17/04/2023",
    "endDateFormatted": "23/04/2023",
    "startDate": "2023-04-17T00:00:00.000Z",
    "endDate": "2023-04-23T00:00:00.000Z",
    "tweet": "",
    "land": [
      {
        "temtem": "Pycko",
        "areas": [
          "Caves"
        ],
        "ratePercent": 50,
        "lumaRate": 1,
        "minSvs": 26,
        "eggTechPercent": 6
      },
      {
        "temtem": "Chimurian",
        "areas": [
          "Fields"
        ],
        "ratePercent": 40,
        "lumaRate": 1,
        "minSvs": 26,
        "eggTechPercent": 6
      }
    ],
    "water": []
  },
  {
    "dateRange": "Apr 10th to Apr 16th 2023",
    "startDateFormatted": "10/04/2023",
    "endDateFormatted": "16/04/2023",
    "startDate": "2023-04-10T00:00:00.000Z",
    "endDate": "2023-04-16T00:00:00.000Z",
    "tweet": "",
    "land": [
      {
        "temtem": "Galvanid",
        "areas": [
          "Fields"
        ],
        "ratePercent": 65,
        "lumaRate": 3,
        "minSvs": 0,
        "eggTechPercent": 8
      }
    ],
    "water": [
      {
        "temtem": "Kalazu",
        "areas": [
          "Water"
        ],
        "ratePercent": 100,
        "lumaRate": 5,
        "minSvs": 0,
        "eggTechPercent": 25
      }
    ]
  },
  {
    "dateRange": "Apr 3rd to Apr 9th 2023",
    "startDateFormatted": "03/04/2023",
    "endDateFormatted": "09/04/2023",
    "startDate": "2023-04-03T00:00:00.000Z",
    "endDate": "2023-04-09T00:00:00.000Z",
    "tweet": "",
    "land": [
      {
        "temtem": "Zephyruff",
        "areas": [
          "Hills"
        ],
        "ratePercent": 80,
        "lumaRate": 1,
        "minSvs": 30,
        "eggTechPercent": 10
      }
    ],
    "water": [
      {
        "temtem": "Bigu",
        "areas": [
          "Water"
        ],
        "ratePercent": 80,
        "lumaRate": 1,
        "minSvs": 26,
        "eggTechPercent": 10
      }
    ]
  },
  {
    "dateRange": "Mar 27th to Apr 2nd 2023",
    "startDateFormatted": "27/03/2023",
    "endDateFormatted": "02/04/2023",
    "startDate": "2023-03-27T00:00:00.000Z",
    "endDate": "2023-04-02T00:00:00.000Z",
    "tweet": "",
    "land": [
      {
        "temtem": "Kaku",
        "areas": [
          "Fields"
        ],
        "ratePercent": 95,
        "lumaRate": 4,
        "minSvs": 0,
        "eggTechPercent": 16
      },
      {
        "temtem": "Mitty",
        "areas": [
          "Hills"
        ],
        "ratePercent": 100,
        "lumaRate": 4,
        "minSvs": 0,
        "eggTechPercent": 11
      }
    ],
    "water": []
  },
  {
    "dateRange": "Mar 20th to Mar 26th 2023",
    "startDateFormatted": "20/03/2023",
    "endDateFormatted": "26/03/2023",
    "startDate": "2023-03-20T00:00:00.000Z",
    "endDate": "2023-03-26T00:00:00.000Z",
    "tweet": "",
    "land": [
      {
        "temtem": "Goty",
        "areas": [
          "Fields"
        ],
        "ratePercent": 95,
        "lumaRate": 1,
        "minSvs": 31,
        "eggTechPercent": 5
      },
      {
        "temtem": "Shaolite",
        "areas": [
          "Hills"
        ],
        "ratePercent": 90,
        "lumaRate": 1,
        "minSvs": 37,
        "eggTechPercent": 11
      }
    ],
    "water": []
  },
  {
    "dateRange": "Mar 13th to Mar 19th 2023",
    "startDateFormatted": "13/03/2023",
    "endDateFormatted": "19/03/2023",
    "startDate": "2023-03-13T00:00:00.000Z",
    "endDate": "2023-03-19T00:00:00.000Z",
    "tweet": "",
    "land": [
      {
        "temtem": "Bigu",
        "areas": [
          "Caves"
        ],
        "ratePercent": 80,
        "lumaRate": 3,
        "minSvs": 0,
        "eggTechPercent": 13
      },
      {
        "temtem": "Cycrox",
        "areas": [
          "Fields"
        ],
        "ratePercent": 80,
        "lumaRate": 3,
        "minSvs": 0,
        "eggTechPercent": 16
      }
    ],
    "water": []
  },
  {
    "dateRange": "Mar 6th to Mar 12th 2023",
    "startDateFormatted": "06/03/2023",
    "endDateFormatted": "12/03/2023",
    "startDate": "2023-03-06T00:00:00.000Z",
    "endDate": "2023-03-12T00:00:00.000Z",
    "tweet": "",
    "land": [
      {
        "temtem": "Raiber",
        "areas": [
          "Caves"
        ],
        "ratePercent": 55,
        "lumaRate": 1,
        "minSvs": 37,
        "eggTechPercent": 15
      },
      {
        "temtem": "Zizare",
        "areas": [
          "Fields"
        ],
        "ratePercent": 45,
        "lumaRate": 1,
        "minSvs": 30,
        "eggTechPercent": 18
      }
    ],
    "water": []
  },
  {
    "dateRange": "Feb 27th to Mar 5th 2023",
    "startDateFormatted": "27/02/2023",
    "endDateFormatted": "05/03/2023",
    "startDate": "2023-02-27T00:00:00.000Z",
    "endDate": "2023-03-05T00:00:00.000Z",
    "tweet": "",
    "land": [
      {
        "temtem": "Smolzy",
        "areas": [
          "Caves"
        ],
        "ratePercent": 60,
        "lumaRate": 4,
        "minSvs": 0,
        "eggTechPercent": 12
      }
    ],
    "water": [
      {
        "temtem": "Platypet",
        "areas": [
          "Water"
        ],
        "ratePercent": 85,
        "lumaRate": 4,
        "minSvs": 0,
        "eggTechPercent": 18
      }
    ]
  },
  {
    "dateRange": "Feb 20th to Feb 26th 2023",
    "startDateFormatted": "20/02/2023",
    "endDateFormatted": "26/02/2023",
    "startDate": "2023-02-20T00:00:00.000Z",
    "endDate": "2023-02-26T00:00:00.000Z",
    "tweet": "",
    "land": [
      {
        "temtem": "Toxolotl",
        "areas": [
          "Caves"
        ],
        "ratePercent": 100,
        "lumaRate": 1,
        "minSvs": 39,
        "eggTechPercent": 7
      }
    ],
    "water": [
      {
        "temtem": "Pewki",
        "areas": [
          "Water"
        ],
        "ratePercent": 100,
        "lumaRate": 1,
        "minSvs": 39,
        "eggTechPercent": 11
      }
    ]
  },
  {
    "dateRange": "Feb 13th to Feb 19th 2023",
    "startDateFormatted": "13/02/2023",
    "endDateFormatted": "19/02/2023",
    "startDate": "2023-02-13T00:00:00.000Z",
    "endDate": "2023-02-19T00:00:00.000Z",
    "tweet": "",
    "land": [
      {
        "temtem": "Scarawatt",
        "areas": [
          "Hills"
        ],
        "ratePercent": 90,
        "lumaRate": 4,
        "minSvs": 0,
        "eggTechPercent": 16
      }
    ],
    "water": [
      {
        "temtem": "Koish",
        "areas": [
          "Water"
        ],
        "ratePercent": 100,
        "lumaRate": 4,
        "minSvs": 0,
        "eggTechPercent": 0
      }
    ]
  },
  {
    "dateRange": "Feb 6th to Feb 12th 2023",
    "startDateFormatted": "06/02/2023",
    "endDateFormatted": "12/02/2023",
    "startDate": "2023-02-06T00:00:00.000Z",
    "endDate": "2023-02-12T00:00:00.000Z",
    "tweet": "",
    "land": [
      {
        "temtem": "Chromeon",
        "areas": [
          "Fields"
        ],
        "ratePercent": 65,
        "lumaRate": 1,
        "minSvs": 30,
        "eggTechPercent": 0
      },
      {
        "temtem": "Hocus",
        "areas": [
          "Hills"
        ],
        "ratePercent": 40,
        "lumaRate": 1,
        "minSvs": 30,
        "eggTechPercent": 19
      }
    ],
    "water": []
  },
  {
    "dateRange": "Jan 30th to Feb 5th 2023",
    "startDateFormatted": "30/01/2023",
    "endDateFormatted": "05/02/2023",
    "startDate": "2023-01-30T00:00:00.000Z",
    "endDate": "2023-02-05T00:00:00.000Z",
    "tweet": "",
    "land": [
      {
        "temtem": "Thaiko",
        "areas": [
          "Hills"
        ],
        "ratePercent": 50,
        "lumaRate": 2,
        "minSvs": 0,
        "eggTechPercent": 10
      }
    ],
    "water": [
      {
        "temtem": "Ganki",
        "areas": [
          "Water"
        ],
        "ratePercent": 100,
        "lumaRate": 4,
        "minSvs": 0,
        "eggTechPercent": 30
      }
    ]
  },
  {
    "dateRange": "Jan 23rd to Jan 29th 2023",
    "startDateFormatted": "23/01/2023",
    "endDateFormatted": "29/01/2023",
    "startDate": "2023-01-23T00:00:00.000Z",
    "endDate": "2023-01-29T00:00:00.000Z",
    "tweet": "",
    "land": [
      {
        "temtem": "Hidody",
        "areas": [
          "Fields"
        ],
        "ratePercent": 55,
        "lumaRate": 1,
        "minSvs": 31,
        "eggTechPercent": 10
      },
      {
        "temtem": "Mawtle",
        "areas": [
          "Hills"
        ],
        "ratePercent": 40,
        "lumaRate": 1,
        "minSvs": 26,
        "eggTechPercent": 8
      }
    ],
    "water": []
  },
  {
    "dateRange": "Jan 16th to Jan 22nd 2023",
    "startDateFormatted": "16/01/2023",
    "endDateFormatted": "22/01/2023",
    "startDate": "2023-01-16T00:00:00.000Z",
    "endDate": "2023-01-22T00:00:00.000Z",
    "tweet": "",
    "land": [
      {
        "temtem": "Banapi",
        "areas": [
          "Caves"
        ],
        "ratePercent": 70,
        "lumaRate": 4,
        "minSvs": 0,
        "eggTechPercent": 16
      },
      {
        "temtem": "Akranox",
        "areas": [
          "Fields"
        ],
        "ratePercent": 80,
        "lumaRate": 4,
        "minSvs": 0,
        "eggTechPercent": 14
      }
    ],
    "water": []
  },
  {
    "dateRange": "Jan 9th to Jan 15th 2023",
    "startDateFormatted": "09/01/2023",
    "endDateFormatted": "15/01/2023",
    "startDate": "2023-01-09T00:00:00.000Z",
    "endDate": "2023-01-15T00:00:00.000Z",
    "tweet": "",
    "land": [
      {
        "temtem": "Osuchi",
        "areas": [
          "Fields"
        ],
        "ratePercent": 85,
        "lumaRate": 1,
        "minSvs": 34,
        "eggTechPercent": 14
      },
      {
        "temtem": "Chubee",
        "areas": [
          "Hills"
        ],
        "ratePercent": 70,
        "lumaRate": 1,
        "minSvs": 30,
        "eggTechPercent": 18
      }
    ],
    "water": []
  },
  {
    "dateRange": "Jan 2nd to Jan 8th 2023",
    "startDateFormatted": "02/01/2023",
    "endDateFormatted": "08/01/2023",
    "startDate": "2023-01-02T00:00:00.000Z",
    "endDate": "2023-01-08T00:00:00.000Z",
    "tweet": "",
    "land": [
      {
        "temtem": "Halzhi",
        "areas": [
          "Fields"
        ],
        "ratePercent": 75,
        "lumaRate": 3,
        "minSvs": 0,
        "eggTechPercent": 13
      },
      {
        "temtem": "Gorong",
        "areas": [
          "Hills"
        ],
        "ratePercent": 100,
        "lumaRate": 3,
        "minSvs": 0,
        "eggTechPercent": 20
      }
    ],
    "water": []
  },
  {
    "dateRange": "Dec 26th 2022 to Jan 1st 2023",
    "startDateFormatted": "26/12/2022",
    "endDateFormatted": "01/01/2023",
    "startDate": "2022-12-26T00:00:00.000Z",
    "endDate": "2023-01-01T00:00:00.000Z",
    "tweet": "",
    "land": [
      {
        "temtem": "Lapinite",
        "areas": [
          "Caves"
        ],
        "ratePercent": 90,
        "lumaRate": 1,
        "minSvs": 35,
        "eggTechPercent": 9
      },
      {
        "temtem": "Paharo",
        "areas": [
          "Hills"
        ],
        "ratePercent": 95,
        "lumaRate": 1,
        "minSvs": 35,
        "eggTechPercent": 18
      }
    ],
    "water": []
  },
  {
    "dateRange": "Dec 19th to Dec 25th 2022",
    "startDateFormatted": "19/12/2022",
    "endDateFormatted": "25/12/2022",
    "startDate": "2022-12-19T00:00:00.000Z",
    "endDate": "2022-12-25T00:00:00.000Z",
    "tweet": "",
    "land": [
      {
        "temtem": "Mosu",
        "areas": [
          "Fields"
        ],
        "ratePercent": 85,
        "lumaRate": 4,
        "minSvs": 0,
        "eggTechPercent": 16
      },
      {
        "temtem": "Reval",
        "areas": [
          "Hills"
        ],
        "ratePercent": 80,
        "lumaRate": 4,
        "minSvs": 0,
        "eggTechPercent": 13
      }
    ],
    "water": []
  },
  {
    "dateRange": "Dec 12th to Dec 18th 2022",
    "startDateFormatted": "12/12/2022",
    "endDateFormatted": "18/12/2022",
    "startDate": "2022-12-12T00:00:00.000Z",
    "endDate": "2022-12-18T00:00:00.000Z",
    "tweet": "",
    "land": [
      {
        "temtem": "Magmis",
        "areas": [
          "Caves"
        ],
        "ratePercent": 90,
        "lumaRate": 1,
        "minSvs": 29,
        "eggTechPercent": 0
      },
      {
        "temtem": "Spriole",
        "areas": [
          "Fields"
        ],
        "ratePercent": 95,
        "lumaRate": 1,
        "minSvs": 29,
        "eggTechPercent": 12
      }
    ],
    "water": []
  },
  {
    "dateRange": "Dec 5th to Dec 11th 2022",
    "startDateFormatted": "05/12/2022",
    "endDateFormatted": "11/12/2022",
    "startDate": "2022-12-05T00:00:00.000Z",
    "endDate": "2022-12-11T00:00:00.000Z",
    "tweet": "",
    "land": [
      {
        "temtem": "Occlura",
        "areas": [
          "Caves"
        ],
        "ratePercent": 60,
        "lumaRate": 4,
        "minSvs": 0,
        "eggTechPercent": 12
      },
      {
        "temtem": "Momo",
        "areas": [
          "Fields"
        ],
        "ratePercent": 95,
        "lumaRate": 2,
        "minSvs": 0,
        "eggTechPercent": 15
      }
    ],
    "water": []
  },
  {
    "dateRange": "Nov 28th to Dec 4th 2022",
    "startDateFormatted": "28/11/2022",
    "endDateFormatted": "04/12/2022",
    "startDate": "2022-11-28T00:00:00.000Z",
    "endDate": "2022-12-04T00:00:00.000Z",
    "tweet": "",
    "land": [
      {
        "temtem": "Oree",
        "areas": [
          "Fields"
        ],
        "ratePercent": 60,
        "lumaRate": 1,
        "minSvs": 34,
        "eggTechPercent": 9
      },
      {
        "temtem": "Maoala",
        "areas": [
          "Hills"
        ],
        "ratePercent": 80,
        "lumaRate": 1,
        "minSvs": 32,
        "eggTechPercent": 10
      }
    ],
    "water": []
  },
  {
    "dateRange": "Nov 21st to Nov 27th 2022",
    "startDateFormatted": "21/11/2022",
    "endDateFormatted": "27/11/2022",
    "startDate": "2022-11-21T00:00:00.000Z",
    "endDate": "2022-11-27T00:00:00.000Z",
    "tweet": "",
    "land": [
      {
        "temtem": "Orphyll",
        "areas": [
          "Caves"
        ],
        "ratePercent": 95,
        "lumaRate": 3,
        "minSvs": 0,
        "eggTechPercent": 18
      },
      {
        "temtem": "Zephyruff",
        "areas": [
          "Hills"
        ],
        "ratePercent": 95,
        "lumaRate": 4,
        "minSvs": 0,
        "eggTechPercent": 13
      }
    ],
    "water": []
  },
  {
    "dateRange": "Nov 14th to Nov 20th 2022",
    "startDateFormatted": "14/11/2022",
    "endDateFormatted": "20/11/2022",
    "startDate": "2022-11-14T00:00:00.000Z",
    "endDate": "2022-11-20T00:00:00.000Z",
    "tweet": "",
    "land": [
      {
        "temtem": "Bunbun",
        "areas": [
          "Caves"
        ],
        "ratePercent": 75,
        "lumaRate": 1,
        "minSvs": 35,
        "eggTechPercent": 12
      },
      {
        "temtem": "Grumvel",
        "areas": [
          "Fields"
        ],
        "ratePercent": 90,
        "lumaRate": 1,
        "minSvs": 33,
        "eggTechPercent": 19
      }
    ],
    "water": []
  },
  {
    "dateRange": "Nov 7th to Nov 13th 2022",
    "startDateFormatted": "07/11/2022",
    "endDateFormatted": "13/11/2022",
    "startDate": "2022-11-07T00:00:00.000Z",
    "endDate": "2022-11-13T00:00:00.000Z",
    "tweet": "",
    "land": [
      {
        "temtem": "Goty",
        "areas": [
          "Fields"
        ],
        "ratePercent": 80,
        "lumaRate": 4,
        "minSvs": 0,
        "eggTechPercent": 12
      },
      {
        "temtem": "Kuri",
        "areas": [
          "Hills"
        ],
        "ratePercent": 85,
        "lumaRate": 4,
        "minSvs": 0,
        "eggTechPercent": 11
      }
    ],
    "water": []
  },
  {
    "dateRange": "Oct 31st to Nov 6th 2022",
    "startDateFormatted": "31/10/2022",
    "endDateFormatted": "06/11/2022",
    "startDate": "2022-10-31T00:00:00.000Z",
    "endDate": "2022-11-06T00:00:00.000Z",
    "tweet": "",
    "land": [
      {
        "temtem": "Hoglip",
        "areas": [
          "Caves"
        ],
        "ratePercent": 60,
        "lumaRate": 1,
        "minSvs": 39,
        "eggTechPercent": 10
      }
    ],
    "water": [
      {
        "temtem": "Nessla",
        "areas": [
          "Water"
        ],
        "ratePercent": 55,
        "lumaRate": 1,
        "minSvs": 30,
        "eggTechPercent": 13
      }
    ]
  },
  {
    "dateRange": "Oct 24th to Oct 30th 2022",
    "startDateFormatted": "24/10/2022",
    "endDateFormatted": "30/10/2022",
    "startDate": "2022-10-24T00:00:00.000Z",
    "endDate": "2022-10-30T00:00:00.000Z",
    "tweet": "",
    "land": [
      {
        "temtem": "Mimit",
        "areas": [
          "Fields"
        ],
        "ratePercent": 40,
        "lumaRate": 2,
        "minSvs": 0,
        "eggTechPercent": 0
      },
      {
        "temtem": "Arachnyte",
        "areas": [
          "Hills"
        ],
        "ratePercent": 60,
        "lumaRate": 2,
        "minSvs": 0,
        "eggTechPercent": 17
      }
    ],
    "water": []
  },
  {
    "dateRange": "Oct 17th to Oct 23rd 2022",
    "startDateFormatted": "17/10/2022",
    "endDateFormatted": "23/10/2022",
    "startDate": "2022-10-17T00:00:00.000Z",
    "endDate": "2022-10-23T00:00:00.000Z",
    "tweet": "",
    "land": [
      {
        "temtem": "0b1",
        "areas": [
          "Hills"
        ],
        "ratePercent": 80,
        "lumaRate": 1,
        "minSvs": 30,
        "eggTechPercent": 20
      },
      {
        "temtem": "Blooze",
        "areas": [
          "Caves"
        ],
        "ratePercent": 55,
        "lumaRate": 1,
        "minSvs": 34,
        "eggTechPercent": 14
      }
    ],
    "water": []
  },
  {
    "dateRange": "Oct 10th to Oct 16th 2022",
    "startDateFormatted": "10/10/2022",
    "endDateFormatted": "16/10/2022",
    "startDate": "2022-10-10T00:00:00.000Z",
    "endDate": "2022-10-16T00:00:00.000Z",
    "tweet": "",
    "land": [
      {
        "temtem": "Pycko",
        "areas": [
          "Caves"
        ],
        "ratePercent": 70,
        "lumaRate": 2,
        "minSvs": 0,
        "eggTechPercent": 19
      },
      {
        "temtem": "Mawtle",
        "areas": [
          "Fields"
        ],
        "ratePercent": 55,
        "lumaRate": 2,
        "minSvs": 0,
        "eggTechPercent": 17
      }
    ],
    "water": []
  },
  {
    "dateRange": "Oct 3rd to Oct 9th 2022",
    "startDateFormatted": "03/10/2022",
    "endDateFormatted": "09/10/2022",
    "startDate": "2022-10-03T00:00:00.000Z",
    "endDate": "2022-10-09T00:00:00.000Z",
    "tweet": "",
    "land": [
      {
        "temtem": "Ampling",
        "areas": [
          "Hills"
        ],
        "ratePercent": 95,
        "lumaRate": 1,
        "minSvs": 32,
        "eggTechPercent": 16
      }
    ],
    "water": [
      {
        "temtem": "Umishi",
        "areas": [
          "Water"
        ],
        "ratePercent": 95,
        "lumaRate": 1,
        "minSvs": 38,
        "eggTechPercent": 8
      }
    ]
  },
  {
    "dateRange": "Sep 26th to Oct 2nd 2022",
    "startDateFormatted": "26/09/2022",
    "endDateFormatted": "02/10/2022",
    "startDate": "2022-09-26T00:00:00.000Z",
    "endDate": "2022-10-02T00:00:00.000Z",
    "tweet": "",
    "land": [
      {
        "temtem": "Shaolite",
        "areas": [
          "Fields"
        ],
        "ratePercent": 95,
        "lumaRate": 4,
        "minSvs": 0,
        "eggTechPercent": 17
      },
      {
        "temtem": "Vulffy",
        "areas": [
          "Hills"
        ],
        "ratePercent": 80,
        "lumaRate": 4,
        "minSvs": 0,
        "eggTechPercent": 19
      }
    ],
    "water": []
  },
  {
    "dateRange": "Sep 19th to Sep 25th 2022",
    "startDateFormatted": "19/09/2022",
    "endDateFormatted": "25/09/2022",
    "startDate": "2022-09-19T00:00:00.000Z",
    "endDate": "2022-09-25T00:00:00.000Z",
    "tweet": "",
    "land": [
      {
        "temtem": "Saipat",
        "areas": [
          "Fields"
        ],
        "ratePercent": 100,
        "lumaRate": 1,
        "minSvs": 33,
        "eggTechPercent": 16
      },
      {
        "temtem": "Hazrat",
        "areas": [
          "Caves"
        ],
        "ratePercent": 100,
        "lumaRate": 1,
        "minSvs": 32,
        "eggTechPercent": 8
      }
    ],
    "water": []
  },
  {
    "dateRange": "Sep 12th to Sep 18th 2022",
    "startDateFormatted": "12/09/2022",
    "endDateFormatted": "18/09/2022",
    "startDate": "2022-09-12T00:00:00.000Z",
    "endDate": "2022-09-18T00:00:00.000Z",
    "tweet": "",
    "land": [
      {
        "temtem": "Hidody",
        "areas": [
          "Fields"
        ],
        "ratePercent": 85,
        "lumaRate": 4,
        "minSvs": 0,
        "eggTechPercent": 17
      },
      {
        "temtem": "Broccoblin",
        "areas": [
          "Hills"
        ],
        "ratePercent": 75,
        "lumaRate": 4,
        "minSvs": 0,
        "eggTechPercent": 19
      }
    ],
    "water": []
  },
  {
    "dateRange": "Sep 5th to Sep 11th 2022",
    "startDateFormatted": "05/09/2022",
    "endDateFormatted": "11/09/2022",
    "startDate": "2022-09-05T00:00:00.000Z",
    "endDate": "2022-09-11T00:00:00.000Z",
    "tweet": "",
    "land": [
      {
        "temtem": "Mitty",
        "areas": [
          "Fields"
        ],
        "ratePercent": 100,
        "lumaRate": 1,
        "minSvs": 36,
        "eggTechPercent": 16
      }
    ],
    "water": [
      {
        "temtem": "Fomu",
        "areas": [
          "Water"
        ],
        "ratePercent": 100,
        "lumaRate": 1,
        "minSvs": 36,
        "eggTechPercent": 10
      }
    ]
  },
  {
    "dateRange": "Aug 29th to Sep 4th 2022",
    "startDateFormatted": "29/08/2022",
    "endDateFormatted": "04/09/2022",
    "startDate": "2022-08-29T00:00:00.000Z",
    "endDate": "2022-09-04T00:00:00.000Z",
    "tweet": "",
    "land": [
      {
        "temtem": "Toxolotl",
        "areas": [
          "Caves"
        ],
        "ratePercent": 100,
        "lumaRate": 8,
        "minSvs": 0,
        "eggTechPercent": 16
      }
    ],
    "water": [
      {
        "temtem": "Pewki",
        "areas": [
          "Water"
        ],
        "ratePercent": 100,
        "lumaRate": 8,
        "minSvs": 0,
        "eggTechPercent": 17
      }
    ]
  },
  {
    "dateRange": "Aug 22nd to Aug 28th 2022",
    "startDateFormatted": "22/08/2022",
    "endDateFormatted": "28/08/2022",
    "startDate": "2022-08-22T00:00:00.000Z",
    "endDate": "2022-08-28T00:00:00.000Z",
    "tweet": "",
    "land": [
      {
        "temtem": "Kaku",
        "areas": [
          "Fields"
        ],
        "ratePercent": 100,
        "lumaRate": 1,
        "minSvs": 29,
        "eggTechPercent": 12
      },
      {
        "temtem": "Pigepic",
        "areas": [
          "Hills"
        ],
        "ratePercent": 100,
        "lumaRate": 1,
        "minSvs": 28,
        "eggTechPercent": 12
      }
    ],
    "water": []
  },
  {
    "dateRange": "Aug 15th to Aug 21st 2022",
    "startDateFormatted": "15/08/2022",
    "endDateFormatted": "21/08/2022",
    "startDate": "2022-08-15T00:00:00.000Z",
    "endDate": "2022-08-21T00:00:00.000Z",
    "tweet": "",
    "land": [
      {
        "temtem": "Magmis",
        "areas": [
          "Caves"
        ],
        "ratePercent": 80,
        "lumaRate": 4,
        "minSvs": 0,
        "eggTechPercent": 0
      },
      {
        "temtem": "Spriole",
        "areas": [
          "Fields"
        ],
        "ratePercent": 95,
        "lumaRate": 4,
        "minSvs": 0,
        "eggTechPercent": 14
      }
    ],
    "water": []
  },
  {
    "dateRange": "Aug 8th to Aug 14th 2022",
    "startDateFormatted": "08/08/2022",
    "endDateFormatted": "14/08/2022",
    "startDate": "2022-08-08T00:00:00.000Z",
    "endDate": "2022-08-14T00:00:00.000Z",
    "tweet": "",
    "land": [
      {
        "temtem": "Swali",
        "areas": [
          "Fields"
        ],
        "ratePercent": 90,
        "lumaRate": 1,
        "minSvs": 28,
        "eggTechPercent": 10
      },
      {
        "temtem": "Valiar",
        "areas": [
          "Hills"
        ],
        "ratePercent": 45,
        "lumaRate": 1,
        "minSvs": 26,
        "eggTechPercent": 0
      }
    ],
    "water": []
  },
  {
    "dateRange": "Aug 1st to Aug 7th 2022",
    "startDateFormatted": "01/08/2022",
    "endDateFormatted": "07/08/2022",
    "startDate": "2022-08-01T00:00:00.000Z",
    "endDate": "2022-08-07T00:00:00.000Z",
    "tweet": "",
    "land": [
      {
        "temtem": "Raiber",
        "areas": [
          "Caves"
        ],
        "ratePercent": 75,
        "lumaRate": 3,
        "minSvs": 0,
        "eggTechPercent": 11
      },
      {
        "temtem": "Chromeon",
        "areas": [
          "Fields"
        ],
        "ratePercent": 60,
        "lumaRate": 4,
        "minSvs": 0,
        "eggTechPercent": 0
      }
    ],
    "water": []
  },
  {
    "dateRange": "Jul 25th to Jul 31st 2022",
    "startDateFormatted": "25/07/2022",
    "endDateFormatted": "31/07/2022",
    "startDate": "2022-07-25T00:00:00.000Z",
    "endDate": "2022-07-31T00:00:00.000Z",
    "tweet": "",
    "land": [
      {
        "temtem": "Tateru",
        "areas": [
          "Fields"
        ],
        "ratePercent": 100,
        "lumaRate": 1,
        "minSvs": 26,
        "eggTechPercent": 14
      },
      {
        "temtem": "Mushi",
        "areas": [
          "Caves"
        ],
        "ratePercent": 80,
        "lumaRate": 1,
        "minSvs": 26,
        "eggTechPercent": 14
      }
    ],
    "water": []
  },
  {
    "dateRange": "Jul 18th to Jul 24th 2022",
    "startDateFormatted": "18/07/2022",
    "endDateFormatted": "24/07/2022",
    "startDate": "2022-07-18T00:00:00.000Z",
    "endDate": "2022-07-24T00:00:00.000Z",
    "tweet": "",
    "land": [
      {
        "temtem": "Osuchi",
        "areas": [
          "Fields"
        ],
        "ratePercent": 90,
        "lumaRate": 3,
        "minSvs": 0,
        "eggTechPercent": 15
      },
      {
        "temtem": "Paharo",
        "areas": [
          "Hills"
        ],
        "ratePercent": 95,
        "lumaRate": 4,
        "minSvs": 0,
        "eggTechPercent": 11
      }
    ],
    "water": []
  },
  {
    "dateRange": "Jul 11th to Jul 18th 2022",
    "startDateFormatted": "11/07/2022",
    "endDateFormatted": "18/07/2022",
    "startDate": "2022-07-11T00:00:00.000Z",
    "endDate": "2022-07-18T00:00:00.000Z",
    "tweet": "",
    "land": [
      {
        "temtem": "Skail",
        "areas": [
          "Caves"
        ],
        "ratePercent": 100,
        "lumaRate": 1,
        "minSvs": 27,
        "eggTechPercent": 9
      },
      {
        "temtem": "Cycrox",
        "areas": [
          "Fields"
        ],
        "ratePercent": 70,
        "lumaRate": 1,
        "minSvs": 27,
        "eggTechPercent": 11
      }
    ],
    "water": []
  },
  {
    "dateRange": "Jul 4th to Jul 10th 2022",
    "startDateFormatted": "04/07/2022",
    "endDateFormatted": "10/07/2022",
    "startDate": "2022-07-04T00:00:00.000Z",
    "endDate": "2022-07-10T00:00:00.000Z",
    "tweet": "",
    "land": [
      {
        "temtem": "Lapinite",
        "areas": [
          "Caves"
        ],
        "ratePercent": 85,
        "lumaRate": 4,
        "minSvs": 0,
        "eggTechPercent": 18
      }
    ],
    "water": [
      {
        "temtem": "Droply",
        "areas": [
          "Water"
        ],
        "ratePercent": 100,
        "lumaRate": 4,
        "minSvs": 0,
        "eggTechPercent": 19
      }
    ]
  },
  {
    "dateRange": "Jun 27th to Jul 3rd 2022",
    "startDateFormatted": "27/06/2022",
    "endDateFormatted": "03/07/2022",
    "startDate": "2022-06-27T00:00:00.000Z",
    "endDate": "2022-07-03T00:00:00.000Z",
    "tweet": "",
    "land": [
      {
        "temtem": "Minttle",
        "areas": [
          "Fields"
        ],
        "ratePercent": 90,
        "lumaRate": 1,
        "minSvs": 26,
        "eggTechPercent": 7
      }
    ],
    "water": [
      {
        "temtem": "Platypet",
        "areas": [
          "Water"
        ],
        "ratePercent": 90,
        "lumaRate": 1,
        "minSvs": 31,
        "eggTechPercent": 10
      }
    ]
  },
  {
    "dateRange": "Jun 20th to Jun 26th 2022",
    "startDateFormatted": "20/06/2022",
    "endDateFormatted": "26/06/2022",
    "startDate": "2022-06-20T00:00:00.000Z",
    "endDate": "2022-06-26T00:00:00.000Z",
    "tweet": "",
    "land": [
      {
        "temtem": "Zizare",
        "areas": [
          "Fields"
        ],
        "ratePercent": 50,
        "lumaRate": 3,
        "minSvs": 0,
        "eggTechPercent": 18
      },
      {
        "temtem": "Hocus",
        "areas": [
          "Hills"
        ],
        "ratePercent": 50,
        "lumaRate": 3,
        "minSvs": 0,
        "eggTechPercent": 15
      }
    ],
    "water": []
  },
  {
    "dateRange": "Jun 13th to Jun 19th 2022",
    "startDateFormatted": "13/06/2022",
    "endDateFormatted": "19/06/2022",
    "startDate": "2022-06-13T00:00:00.000Z",
    "endDate": "2022-06-19T00:00:00.000Z",
    "tweet": "https://pbs.twimg.com/media/FVHiyN9WQAEX3uo.jpg:large",
    "land": [
      {
        "temtem": "Banapi",
        "areas": [
          "Caves"
        ],
        "ratePercent": 70,
        "lumaRate": 1,
        "minSvs": 32,
        "eggTechPercent": 7
      },
      {
        "temtem": "Vulvir",
        "areas": [
          "Fields"
        ],
        "ratePercent": 79,
        "lumaRate": 1,
        "minSvs": 30,
        "eggTechPercent": 13
      }
    ],
    "water": []
  },
  {
    "dateRange": "Jun 6th to Jun 12th 2022",
    "startDateFormatted": "06/06/2022",
    "endDateFormatted": "12/06/2022",
    "startDate": "2022-06-06T00:00:00.000Z",
    "endDate": "2022-06-12T00:00:00.000Z",
    "tweet": "https://pbs.twimg.com/media/FUjgKH3WQAIpMHG.jpg:large",
    "land": [
      {
        "temtem": "Oree",
        "areas": [
          "Fields"
        ],
        "ratePercent": 65,
        "lumaRate": 4,
        "minSvs": 0,
        "eggTechPercent": 18
      },
      {
        "temtem": "Chubee",
        "areas": [
          "Hills"
        ],
        "ratePercent": 60,
        "lumaRate": 4,
        "minSvs": 0,
        "eggTechPercent": 19
      }
    ],
    "water": []
  },
  {
    "dateRange": "May 30th to Jun 5th 2022",
    "startDateFormatted": "30/05/2022",
    "endDateFormatted": "05/06/2022",
    "startDate": "2022-05-30T00:00:00.000Z",
    "endDate": "2022-06-05T00:00:00.000Z",
    "tweet": "https://pbs.twimg.com/media/FT_5WTcWUAE86yV.jpg:large",
    "land": [
      {
        "temtem": "Galvanid",
        "areas": [
          "Hills"
        ],
        "ratePercent": 40,
        "lumaRate": 1,
        "minSvs": 26,
        "eggTechPercent": 6
      },
      {
        "temtem": "Adoroboros",
        "areas": [
          "Caves"
        ],
        "ratePercent": 45,
        "lumaRate": 1,
        "minSvs": 26,
        "eggTechPercent": 11
      }
    ],
    "water": []
  },
  {
    "dateRange": "May 23rd to May 29th 2022",
    "startDateFormatted": "23/05/2022",
    "endDateFormatted": "29/05/2022",
    "startDate": "2022-05-23T00:00:00.000Z",
    "endDate": "2022-05-29T00:00:00.000Z",
    "tweet": "https://pbs.twimg.com/media/FTbag8XXEAEpue1.jpg:large",
    "land": [
      {
        "temtem": "Bunbun",
        "areas": [
          "Caves"
        ],
        "ratePercent": 75,
        "lumaRate": 4,
        "minSvs": 0,
        "eggTechPercent": 14
      },
      {
        "temtem": "Grumvel",
        "areas": [
          "Fields"
        ],
        "ratePercent": 95,
        "lumaRate": 4,
        "minSvs": 0,
        "eggTechPercent": 19
      }
    ],
    "water": []
  },
  {
    "dateRange": "May 16th to May 22nd 2022",
    "startDateFormatted": "16/05/2022",
    "endDateFormatted": "22/05/2022",
    "startDate": "2022-05-16T00:00:00.000Z",
    "endDate": "2022-05-22T00:00:00.000Z",
    "tweet": "https://pbs.twimg.com/media/FS3WD-tWIAESEOG.jpg:large",
    "land": [
      {
        "temtem": "Halzhi",
        "areas": [
          "Fields"
        ],
        "ratePercent": 65,
        "lumaRate": 1,
        "minSvs": 30,
        "eggTechPercent": 8
      },
      {
        "temtem": "Akranox",
        "areas": [
          "Caves"
        ],
        "ratePercent": 75,
        "lumaRate": 1,
        "minSvs": 33,
        "eggTechPercent": 10
      }
    ],
    "water": []
  },
  {
    "dateRange": "May 9th to May 15th 2022",
    "startDateFormatted": "09/05/2022",
    "endDateFormatted": "15/05/2022",
    "startDate": "2022-05-09T00:00:00.000Z",
    "endDate": "2022-05-15T00:00:00.000Z",
    "tweet": "https://pbs.twimg.com/media/FSTS5mLXoAAXyKE.jpg:large",
    "land": [
      {
        "temtem": "Hoglip",
        "areas": [
          "Caves"
        ],
        "ratePercent": 80,
        "lumaRate": 3,
        "minSvs": 0,
        "eggTechPercent": 17
      },
      {
        "temtem": "Nessla",
        "areas": [
          "Hills"
        ],
        "ratePercent": 75,
        "lumaRate": 2,
        "minSvs": 0,
        "eggTechPercent": 15
      }
    ],
    "water": []
  },
  {
    "dateRange": "May 2nd to May 8th 2022",
    "startDateFormatted": "02/05/2022",
    "endDateFormatted": "08/05/2022",
    "startDate": "2022-05-02T00:00:00.000Z",
    "endDate": "2022-05-08T00:00:00.000Z",
    "tweet": "https://pbs.twimg.com/media/FRvPz54XMAECoqK.jpg:large",
    "land": [
      {
        "temtem": "Scarawatt",
        "areas": [
          "Hills"
        ],
        "ratePercent": 100,
        "lumaRate": 1,
        "minSvs": 33,
        "eggTechPercent": 12
      },
      {
        "temtem": "Gorong",
        "areas": [
          "Fields"
        ],
        "ratePercent": 85,
        "lumaRate": 1,
        "minSvs": 32,
        "eggTechPercent": 10
      }
    ],
    "water": []
  },
  {
    "dateRange": "Apr 25th to May 1st 2022",
    "startDateFormatted": "25/04/2022",
    "endDateFormatted": "01/05/2022",
    "startDate": "2022-04-25T00:00:00.000Z",
    "endDate": "2022-05-01T00:00:00.000Z",
    "tweet": "https://pbs.twimg.com/media/FRLNusmWUAE88bn.jpg:large",
    "land": [
      {
        "temtem": "Ampling",
        "areas": [
          "Hills"
        ],
        "ratePercent": 85,
        "lumaRate": 4,
        "minSvs": 0,
        "eggTechPercent": 15
      },
      {
        "temtem": "0b1",
        "areas": [
          "Fields"
        ],
        "ratePercent": 75,
        "lumaRate": 4,
        "minSvs": 0,
        "eggTechPercent": 13
      }
    ],
    "water": []
  },
  {
    "dateRange": "Apr 18th to Apr 24th 2022",
    "startDateFormatted": "18/04/2022",
    "endDateFormatted": "24/04/2022",
    "startDate": "2022-04-18T00:00:00.000Z",
    "endDate": "2022-04-24T00:00:00.000Z",
    "tweet": "https://pbs.twimg.com/media/FQnJzs8XEAIO1eh.jpg:large",
    "land": [
      {
        "temtem": "Reval",
        "areas": [
          "Fields"
        ],
        "ratePercent": 85,
        "lumaRate": 1,
        "minSvs": 32,
        "eggTechPercent": 5
      },
      {
        "temtem": "Ganki",
        "areas": [
          "Hills"
        ],
        "ratePercent": 100,
        "lumaRate": 1,
        "minSvs": 31,
        "eggTechPercent": 6
      }
    ],
    "water": []
  },
  {
    "dateRange": "Apr 11th to Apr 17th 2022",
    "startDateFormatted": "11/04/2022",
    "endDateFormatted": "17/04/2022",
    "startDate": "2022-04-11T00:00:00.000Z",
    "endDate": "2022-04-17T00:00:00.000Z",
    "tweet": "https://pbs.twimg.com/media/FQDGvYMWYAE5wrq.jpg:large",
    "land": [
      {
        "temtem": "Venx",
        "areas": [
          "Caves"
        ],
        "ratePercent": 50,
        "lumaRate": 2,
        "minSvs": 0,
        "eggTechPercent": 5
      }
    ],
    "water": [
      {
        "temtem": "Umishi",
        "areas": [
          "Water"
        ],
        "ratePercent": 100,
        "lumaRate": 4,
        "minSvs": 0,
        "eggTechPercent": 20
      }
    ]
  },
  {
    "dateRange": "Apr 4th to Apr 10th 2022",
    "startDateFormatted": "04/04/2022",
    "endDateFormatted": "10/04/2022",
    "startDate": "2022-04-04T00:00:00.000Z",
    "endDate": "2022-04-10T00:00:00.000Z",
    "tweet": "https://pbs.twimg.com/media/FPfEFw-WYAIJ_Sr.jpg:large",
    "land": [
      {
        "temtem": "Occlura",
        "areas": [
          "Caves"
        ],
        "ratePercent": 65,
        "lumaRate": 1,
        "minSvs": 29,
        "eggTechPercent": 14
      },
      {
        "temtem": "Momo",
        "areas": [
          "Fields"
        ],
        "ratePercent": 60,
        "lumaRate": 1,
        "minSvs": 27,
        "eggTechPercent": 9
      }
    ],
    "water": []
  },
  {
    "dateRange": "Mar 28th to Apr 3rd 2022",
    "startDateFormatted": "28/03/2022",
    "endDateFormatted": "03/04/2022",
    "startDate": "2022-03-28T00:00:00.000Z",
    "endDate": "2022-04-03T00:00:00.000Z",
    "tweet": "https://pbs.twimg.com/media/FO7A7UmWUAEP2vt.jpg:large",
    "land": [
      {
        "temtem": "Blooze",
        "areas": [
          "Caves"
        ],
        "ratePercent": 75,
        "lumaRate": 3,
        "minSvs": 0,
        "eggTechPercent": 8
      },
      {
        "temtem": "Mushi",
        "areas": [
          "Fields"
        ],
        "ratePercent": 85,
        "lumaRate": 3,
        "minSvs": 0,
        "eggTechPercent": 20
      }
    ],
    "water": []
  },
  {
    "dateRange": "Mar 21st to Mar 27th 2022",
    "startDateFormatted": "21/03/2022",
    "endDateFormatted": "27/03/2022",
    "startDate": "2022-03-21T00:00:00.000Z",
    "endDate": "2022-03-27T00:00:00.000Z",
    "tweet": "https://pbs.twimg.com/media/FOW9k0iXIAQAOam.jpg:large",
    "land": [
      {
        "temtem": "Mosu",
        "areas": [
          "Fields"
        ],
        "ratePercent": 95,
        "lumaRate": 1,
        "minSvs": 28,
        "eggTechPercent": 9
      },
      {
        "temtem": "Kuri",
        "areas": [
          "Hills"
        ],
        "ratePercent": 90,
        "lumaRate": 1,
        "minSvs": 30,
        "eggTechPercent": 10
      }
    ],
    "water": []
  },
  {
    "dateRange": "Mar 14th to Mar 20th 2022",
    "startDateFormatted": "14/03/2022",
    "endDateFormatted": "20/03/2022",
    "startDate": "2022-03-14T00:00:00.000Z",
    "endDate": "2022-03-20T00:00:00.000Z",
    "tweet": "https://pbs.twimg.com/media/FNy6aiYXIAEuYRJ.jpg:large",
    "land": [
      {
        "temtem": "Vulvir",
        "areas": [
          "Caves"
        ],
        "ratePercent": 80,
        "lumaRate": 4,
        "minSvs": 0,
        "eggTechPercent": 19
      }
    ],
    "water": [
      {
        "temtem": "Fomu",
        "areas": [
          "Water"
        ],
        "ratePercent": 100,
        "lumaRate": 4,
        "minSvs": 0,
        "eggTechPercent": 14
      }
    ]
  },
  {
    "dateRange": "Mar 7th to Mar 13th 2022",
    "startDateFormatted": "07/03/2022",
    "endDateFormatted": "13/03/2022",
    "startDate": "2022-03-07T00:00:00.000Z",
    "endDate": "2022-03-13T00:00:00.000Z",
    "tweet": "https://pbs.twimg.com/media/FNO3hK4XMAEhxq7.jpg:large",
    "land": [
      {
        "temtem": "Goty",
        "areas": [
          "Fields"
        ],
        "ratePercent": 85,
        "lumaRate": 1,
        "minSvs": 30,
        "eggTechPercent": 8
      },
      {
        "temtem": "Orphyll",
        "areas": [
          "Caves"
        ],
        "ratePercent": 80,
        "lumaRate": 1,
        "minSvs": 28,
        "eggTechPercent": 12
      }
    ],
    "water": []
  },
  {
    "dateRange": "Feb 28th to Mar 6th 2022",
    "startDateFormatted": "28/02/2022",
    "endDateFormatted": "06/03/2022",
    "startDate": "2022-02-28T00:00:00.000Z",
    "endDate": "2022-03-06T00:00:00.000Z",
    "tweet": "https://pbs.twimg.com/media/FMqzjIvWUAAlXLN.jpg:large",
    "land": [
      {
        "temtem": "Saipat",
        "areas": [
          "Fields"
        ],
        "ratePercent": 100,
        "lumaRate": 4,
        "minSvs": 0,
        "eggTechPercent": 15
      },
      {
        "temtem": "Hazrat",
        "areas": [
          "Caves"
        ],
        "ratePercent": 95,
        "lumaRate": 4,
        "minSvs": 0,
        "eggTechPercent": 12
      }
    ],
    "water": []
  },
  {
    "dateRange": "Feb 21st to Feb 27th 2022",
    "startDateFormatted": "21/02/2022",
    "endDateFormatted": "27/02/2022",
    "startDate": "2022-02-21T00:00:00.000Z",
    "endDate": "2022-02-27T00:00:00.000Z",
    "tweet": "https://pbs.twimg.com/media/FMGwl2iWYAMJS_3.jpg:large",
    "land": [
      {
        "temtem": "Pycko",
        "areas": [
          "Caves"
        ],
        "ratePercent": 50,
        "lumaRate": 1,
        "minSvs": 26,
        "eggTechPercent": 6
      },
      {
        "temtem": "Chimurian",
        "areas": [
          "Fields"
        ],
        "ratePercent": 40,
        "lumaRate": 1,
        "minSvs": 26,
        "eggTechPercent": 6
      }
    ],
    "water": []
  },
  {
    "dateRange": "Feb 14th to Feb 20th 2022",
    "startDateFormatted": "14/02/2022",
    "endDateFormatted": "20/02/2022",
    "startDate": "2022-02-14T00:00:00.000Z",
    "endDate": "2022-02-20T00:00:00.000Z",
    "tweet": "https://pbs.twimg.com/media/FLiteNMXoAEGD1c.jpg:large",
    "land": [
      {
        "temtem": "Galvanid",
        "areas": [
          "Fields"
        ],
        "ratePercent": 65,
        "lumaRate": 3,
        "minSvs": 0,
        "eggTechPercent": 8
      }
    ],
    "water": [
      {
        "temtem": "Kalazu",
        "areas": [
          "Water"
        ],
        "ratePercent": 100,
        "lumaRate": 5,
        "minSvs": 0,
        "eggTechPercent": 25
      }
    ]
  },
  {
    "dateRange": "Feb 7th to Feb 13th 2022",
    "startDateFormatted": "07/02/2022",
    "endDateFormatted": "13/02/2022",
    "startDate": "2022-02-07T00:00:00.000Z",
    "endDate": "2022-02-13T00:00:00.000Z",
    "tweet": "https://pbs.twimg.com/media/FK-qjMoXMAAGOfk.jpg:large",
    "land": [
      {
        "temtem": "Zephyruff",
        "areas": [
          "Hills"
        ],
        "ratePercent": 80,
        "lumaRate": 1,
        "minSvs": 30,
        "eggTechPercent": 10
      }
    ],
    "water": [
      {
        "temtem": "Bigu",
        "areas": [
          "Water"
        ],
        "ratePercent": 80,
        "lumaRate": 1,
        "minSvs": 26,
        "eggTechPercent": 10
      }
    ]
  },
  {
    "dateRange": "Jan 31st to Feb 6th 2022",
    "startDateFormatted": "31/01/2022",
    "endDateFormatted": "06/02/2022",
    "startDate": "2022-01-31T00:00:00.000Z",
    "endDate": "2022-02-06T00:00:00.000Z",
    "tweet": "https://pbs.twimg.com/media/FKanWb4XEAMmP7r.jpg:large",
    "land": [
      {
        "temtem": "Kaku",
        "areas": [
          "Fields"
        ],
        "ratePercent": 95,
        "lumaRate": 4,
        "minSvs": 0,
        "eggTechPercent": 16
      },
      {
        "temtem": "Mitty",
        "areas": [
          "Hills"
        ],
        "ratePercent": 100,
        "lumaRate": 4,
        "minSvs": 0,
        "eggTechPercent": 11
      }
    ],
    "water": []
  },
  {
    "dateRange": "Jan 24th to Jan 30th 2022",
    "startDateFormatted": "24/01/2022",
    "endDateFormatted": "30/01/2022",
    "startDate": "2022-01-24T00:00:00.000Z",
    "endDate": "2022-01-30T00:00:00.000Z",
    "tweet": "https://pbs.twimg.com/media/FJ2kPXmX0AAb59g.jpg:large",
    "land": [
      {
        "temtem": "Hidody",
        "areas": [
          "Fields"
        ],
        "ratePercent": 55,
        "lumaRate": 1,
        "minSvs": 31,
        "eggTechPercent": 10
      },
      {
        "temtem": "Mawtle",
        "areas": [
          "Hills"
        ],
        "ratePercent": 40,
        "lumaRate": 1,
        "minSvs": 26,
        "eggTechPercent": 8
      }
    ],
    "water": []
  },
  {
    "dateRange": "Jan 17th to Jan 23rd 2022",
    "startDateFormatted": "17/01/2022",
    "endDateFormatted": "23/01/2022",
    "startDate": "2022-01-17T00:00:00.000Z",
    "endDate": "2022-01-23T00:00:00.000Z",
    "tweet": "https://pbs.twimg.com/media/FJShSPQXMAAHHOD.jpg:large",
    "land": [
      {
        "temtem": "Swali",
        "areas": [
          "Fields"
        ],
        "ratePercent": 55,
        "lumaRate": 3,
        "minSvs": 0,
        "eggTechPercent": 17
      },
      {
        "temtem": "Valiar",
        "areas": [
          "Hills"
        ],
        "ratePercent": 55,
        "lumaRate": 3,
        "minSvs": 0,
        "eggTechPercent": 0
      }
    ],
    "water": []
  },
  {
    "dateRange": "Jan 10th to Jan 16th 2022",
    "startDateFormatted": "10/01/2022",
    "endDateFormatted": "16/01/2022",
    "startDate": "2022-01-10T00:00:00.000Z",
    "endDate": "2022-01-16T00:00:00.000Z",
    "tweet": "https://pbs.twimg.com/media/FIueQHqXoAAeOe8.jpg:large",
    "land": [
      {
        "temtem": "Chromeon",
        "areas": [
          "Fields"
        ],
        "ratePercent": 60,
        "lumaRate": 1,
        "minSvs": 29,
        "eggTechPercent": 0
      },
      {
        "temtem": "Broccoblin",
        "areas": [
          "Hills"
        ],
        "ratePercent": 80,
        "lumaRate": 1,
        "minSvs": 26,
        "eggTechPercent": 14
      }
    ],
    "water": []
  },
  {
    "dateRange": "Jan 3rd to Jan 9th 2022",
    "startDateFormatted": "03/01/2022",
    "endDateFormatted": "09/01/2022",
    "startDate": "2022-01-03T00:00:00.000Z",
    "endDate": "2022-01-09T00:00:00.000Z",
    "tweet": "https://pbs.twimg.com/media/FIKa69MXEAA3Z6o.jpg:large",
    "land": [
      {
        "temtem": "Tateru",
        "areas": [
          "Fields"
        ],
        "ratePercent": 100,
        "lumaRate": 3,
        "minSvs": 0,
        "eggTechPercent": 17
      },
      {
        "temtem": "Gorong",
        "areas": [
          "Hills"
        ],
        "ratePercent": 80,
        "lumaRate": 4,
        "minSvs": 0,
        "eggTechPercent": 14
      }
    ],
    "water": []
  },
  {
    "dateRange": "Dec 27th 2021 to Jan 2nd 2022",
    "startDateFormatted": "27/12/2021",
    "endDateFormatted": "02/01/2022",
    "startDate": "2021-12-27T00:00:00.000Z",
    "endDate": "2022-01-02T00:00:00.000Z",
    "tweet": "https://pbs.twimg.com/media/FHmXkMYXoAUkoUS.jpg:large",
    "land": [
      {
        "temtem": "Shaolite",
        "areas": [
          "Fields"
        ],
        "ratePercent": 90,
        "lumaRate": 1,
        "minSvs": 30,
        "eggTechPercent": 14
      }
    ],
    "water": [
      {
        "temtem": "Pewki",
        "areas": [
          "Water"
        ],
        "ratePercent": 100,
        "lumaRate": 1,
        "minSvs": 28,
        "eggTechPercent": 12
      }
    ]
  },
  {
    "dateRange": "Dec 20th to Dec 26th 2021",
    "startDateFormatted": "20/12/2021",
    "endDateFormatted": "26/12/2021",
    "startDate": "2021-12-20T00:00:00.000Z",
    "endDate": "2021-12-26T00:00:00.000Z",
    "tweet": "https://pbs.twimg.com/media/FHCU5CVXoAMF4Lg.jpg:large",
    "land": [
      {
        "temtem": "Mosu",
        "areas": [
          "Fields"
        ],
        "ratePercent": 100,
        "lumaRate": 3,
        "minSvs": 0,
        "eggTechPercent": 16
      },
      {
        "temtem": "Reval",
        "areas": [
          "Hills"
        ],
        "ratePercent": 80,
        "lumaRate": 4,
        "minSvs": 0,
        "eggTechPercent": 20
      }
    ],
    "water": []
  },
  {
    "dateRange": "Dec 13th to Dec 19th 2021",
    "startDateFormatted": "13/12/2021",
    "endDateFormatted": "19/12/2021",
    "startDate": "2021-12-13T00:00:00.000Z",
    "endDate": "2021-12-19T00:00:00.000Z",
    "tweet": "https://pbs.twimg.com/media/FGeRaA2WYAIZNET.jpg:large",
    "land": [
      {
        "temtem": "Spriole",
        "areas": [
          "Fields"
        ],
        "ratePercent": 95,
        "lumaRate": 1,
        "minSvs": 29,
        "eggTechPercent": 12
      },
      {
        "temtem": "Magmis",
        "areas": [
          "Caves"
        ],
        "ratePercent": 90,
        "lumaRate": 1,
        "minSvs": 29,
        "eggTechPercent": 0
      }
    ],
    "water": []
  },
  {
    "dateRange": "Dec 6th to Dec 12th 2021",
    "startDateFormatted": "06/12/2021",
    "endDateFormatted": "12/12/2021",
    "startDate": "2021-12-06T00:00:00.000Z",
    "endDate": "2021-12-12T00:00:00.000Z",
    "tweet": "https://pbs.twimg.com/media/FF6OAHuXIAAO_Mu.jpg:large",
    "land": [
      {
        "temtem": "Skail",
        "areas": [
          "Caves"
        ],
        "ratePercent": 100,
        "lumaRate": 3,
        "minSvs": 0,
        "eggTechPercent": 13
      }
    ],
    "water": [
      {
        "temtem": "Platypet",
        "areas": [
          "Water"
        ],
        "ratePercent": 85,
        "lumaRate": 4,
        "minSvs": 0,
        "eggTechPercent": 13
      }
    ]
  },
  {
    "dateRange": "Nov 29th to Dec 5th 2021",
    "startDateFormatted": "29/11/2021",
    "endDateFormatted": "05/12/2021",
    "startDate": "2021-11-29T00:00:00.000Z",
    "endDate": "2021-12-05T00:00:00.000Z",
    "tweet": "https://pbs.twimg.com/media/FFWK7YrWUAs9wI6.jpg:large",
    "land": [
      {
        "temtem": "Paharo",
        "areas": [
          "Hills"
        ],
        "ratePercent": 95,
        "lumaRate": 1,
        "minSvs": 32,
        "eggTechPercent": 19
      },
      {
        "temtem": "Toxolotl",
        "areas": [
          "Caves"
        ],
        "ratePercent": 100,
        "lumaRate": 1,
        "minSvs": 32,
        "eggTechPercent": 12
      }
    ],
    "water": []
  },
  {
    "dateRange": "Nov 22nd to Nov 28th 2021",
    "startDateFormatted": "22/11/2021",
    "endDateFormatted": "28/11/2021",
    "startDate": "2021-11-22T00:00:00.000Z",
    "endDate": "2021-11-28T00:00:00.000Z",
    "tweet": "https://pbs.twimg.com/media/FEyIJJhXIAMFmgY.jpg:large",
    "land": [
      {
        "temtem": "Orphyll",
        "areas": [
          "Fields"
        ],
        "ratePercent": 95,
        "lumaRate": 3,
        "minSvs": 0,
        "eggTechPercent": 16
      },
      {
        "temtem": "Banapi",
        "areas": [
          "Hills"
        ],
        "ratePercent": 80,
        "lumaRate": 3,
        "minSvs": 0,
        "eggTechPercent": 17
      }
    ],
    "water": []
  },
  {
    "dateRange": "Nov 15th to Nov 21st 2021",
    "startDateFormatted": "15/11/2021",
    "endDateFormatted": "21/11/2021",
    "startDate": "2021-11-15T00:00:00.000Z",
    "endDate": "2021-11-21T00:00:00.000Z",
    "tweet": "https://pbs.twimg.com/media/FEOE8ChX0AAt9da.jpg:large",
    "land": [
      {
        "temtem": "Raiber",
        "areas": [
          "Caves"
        ],
        "ratePercent": 50,
        "lumaRate": 1,
        "minSvs": 32,
        "eggTechPercent": 19
      },
      {
        "temtem": "Hocus",
        "areas": [
          "Fields"
        ],
        "ratePercent": 40,
        "lumaRate": 1,
        "minSvs": 26,
        "eggTechPercent": 17
      }
    ],
    "water": []
  },
  {
    "dateRange": "Nov 8th to Nov 14th 2021",
    "startDateFormatted": "08/11/2021",
    "endDateFormatted": "14/11/2021",
    "startDate": "2021-11-08T00:00:00.000Z",
    "endDate": "2021-11-14T00:00:00.000Z",
    "tweet": "https://pbs.twimg.com/media/FDqBp3NWYAAV2Q4.jpg:large",
    "land": [
      {
        "temtem": "Cycrox",
        "areas": [
          "Caves"
        ],
        "ratePercent": 75,
        "lumaRate": 3,
        "minSvs": 0,
        "eggTechPercent": 15
      },
      {
        "temtem": "Occlura",
        "areas": [
          "Fields"
        ],
        "ratePercent": 75,
        "lumaRate": 3,
        "minSvs": 0,
        "eggTechPercent": 14
      }
    ],
    "water": []
  },
  {
    "dateRange": "Nov 1st to Nov 7th 2021",
    "startDateFormatted": "01/11/2021",
    "endDateFormatted": "07/11/2021",
    "startDate": "2021-11-01T00:00:00.000Z",
    "endDate": "2021-11-07T00:00:00.000Z",
    "tweet": "https://pbs.twimg.com/media/FDGAgLoXMAgkJQ1.jpg:large",
    "land": [
      {
        "temtem": "Vulffy",
        "areas": [
          "Hills"
        ],
        "ratePercent": 85,
        "lumaRate": 1,
        "minSvs": 28,
        "eggTechPercent": 12
      },
      {
        "temtem": "Osuchi",
        "areas": [
          "Fields"
        ],
        "ratePercent": 90,
        "lumaRate": 1,
        "minSvs": 27,
        "eggTechPercent": 12
      }
    ],
    "water": []
  },
  {
    "dateRange": "Oct 25th to Oct 31st 2021",
    "startDateFormatted": "25/10/2021",
    "endDateFormatted": "31/10/2021",
    "startDate": "2021-10-25T00:00:00.000Z",
    "endDate": "2021-10-31T00:00:00.000Z",
    "tweet": "https://pbs.twimg.com/media/FCh7hC6XoAMUD8A.jpg:large",
    "land": [
      {
        "temtem": "Mimit",
        "areas": [
          "Fields"
        ],
        "ratePercent": 50,
        "lumaRate": 2,
        "minSvs": 0,
        "eggTechPercent": 0
      },
      {
        "temtem": "Akranox",
        "areas": [
          "Caves"
        ],
        "ratePercent": 100,
        "lumaRate": 3,
        "minSvs": 0,
        "eggTechPercent": 25
      }
    ],
    "water": []
  },
  {
    "dateRange": "Oct 18th to Oct 24th 2021",
    "startDateFormatted": "18/10/2021",
    "endDateFormatted": "24/10/2021",
    "startDate": "2021-10-18T00:00:00.000Z",
    "endDate": "2021-10-24T00:00:00.000Z",
    "tweet": "https://pbs.twimg.com/media/FB-MZw2XsAIZyfb.jpg:large",
    "land": [
      {
        "temtem": "Lapinite",
        "areas": [
          "Caves"
        ],
        "ratePercent": 90,
        "lumaRate": 1,
        "minSvs": 30,
        "eggTechPercent": 14
      }
    ],
    "water": [
      {
        "temtem": "Droply",
        "areas": [
          "Water"
        ],
        "ratePercent": 100,
        "lumaRate": 1,
        "minSvs": 31,
        "eggTechPercent": 16
      }
    ]
  },
  {
    "dateRange": "Oct 11th to Oct 17th 2021",
    "startDateFormatted": "11/10/2021",
    "endDateFormatted": "17/10/2021",
    "startDate": "2021-10-11T00:00:00.000Z",
    "endDate": "2021-10-17T00:00:00.000Z",
    "tweet": "https://pbs.twimg.com/media/FBZ05oVX0AIr17_.jpg:large",
    "land": [
      {
        "temtem": "Pigepic",
        "areas": [
          "Hills"
        ],
        "ratePercent": 100,
        "lumaRate": 4,
        "minSvs": 0,
        "eggTechPercent": 18
      },
      {
        "temtem": "Kuri",
        "areas": [
          "Fields"
        ],
        "ratePercent": 80,
        "lumaRate": 4,
        "minSvs": 0,
        "eggTechPercent": 11
      }
    ],
    "water": []
  },
  {
    "dateRange": "Oct 4th to Oct 10th 2021",
    "startDateFormatted": "04/10/2021",
    "endDateFormatted": "10/10/2021",
    "startDate": "2021-10-04T00:00:00.000Z",
    "endDate": "2021-10-10T00:00:00.000Z",
    "tweet": "https://pbs.twimg.com/media/FA1yBTkXMAEiEz8.jpg:large",
    "land": [
      {
        "temtem": "Grumvel",
        "areas": [
          "Fields"
        ],
        "ratePercent": 90,
        "lumaRate": 1,
        "minSvs": 29,
        "eggTechPercent": 12
      },
      {
        "temtem": "Bunbun",
        "areas": [
          "Caves"
        ],
        "ratePercent": 75,
        "lumaRate": 1,
        "minSvs": 29,
        "eggTechPercent": 18
      }
    ],
    "water": []
  },
  {
    "dateRange": "Sep 27th to Oct 3rd 2021",
    "startDateFormatted": "27/09/2021",
    "endDateFormatted": "03/10/2021",
    "startDate": "2021-09-27T00:00:00.000Z",
    "endDate": "2021-10-03T00:00:00.000Z",
    "tweet": "https://pbs.twimg.com/media/FARu3BIX0AABH59.jpg:large",
    "land": [
      {
        "temtem": "Zephyruff",
        "areas": [
          "Hills"
        ],
        "ratePercent": 95,
        "lumaRate": 4,
        "minSvs": 0,
        "eggTechPercent": 20
      }
    ],
    "water": [
      {
        "temtem": "Ganki",
        "areas": [
          "Water"
        ],
        "ratePercent": 100,
        "lumaRate": 4,
        "minSvs": 0,
        "eggTechPercent": 20
      }
    ]
  },
  {
    "dateRange": "Sep 20th to Sep 26th 2021",
    "startDateFormatted": "20/09/2021",
    "endDateFormatted": "26/09/2021",
    "startDate": "2021-09-20T00:00:00.000Z",
    "endDate": "2021-09-26T00:00:00.000Z",
    "tweet": "https://pbs.twimg.com/media/E_trjUyWQAEaQsJ.jpg:large",
    "land": [
      {
        "temtem": "Nessla",
        "areas": [
          "Hills"
        ],
        "ratePercent": 50,
        "lumaRate": 1,
        "minSvs": 26,
        "eggTechPercent": 14
      },
      {
        "temtem": "Zizare",
        "areas": [
          "Fields"
        ],
        "ratePercent": 50,
        "lumaRate": 1,
        "minSvs": 26,
        "eggTechPercent": 10
      }
    ],
    "water": []
  },
  {
    "dateRange": "Sep 13th to Sep 19th 2021",
    "startDateFormatted": "13/09/2021",
    "endDateFormatted": "19/09/2021",
    "startDate": "2021-09-13T00:00:00.000Z",
    "endDate": "2021-09-19T00:00:00.000Z",
    "tweet": "https://pbs.twimg.com/media/E_JomtIXoAEHzWw.jpg:large",
    "land": [
      {
        "temtem": "Goty",
        "areas": [
          "Hills"
        ],
        "ratePercent": 90,
        "lumaRate": 4,
        "minSvs": 0,
        "eggTechPercent": 0
      }
    ],
    "water": [
      {
        "temtem": "Kalazu",
        "areas": [
          "Water"
        ],
        "ratePercent": 100,
        "lumaRate": 4,
        "minSvs": 0,
        "eggTechPercent": 20
      }
    ]
  },
  {
    "dateRange": "Sep 6th to Sep 12th 2021",
    "startDateFormatted": "06/09/2021",
    "endDateFormatted": "12/09/2021",
    "startDate": "2021-09-06T00:00:00.000Z",
    "endDate": "2021-09-12T00:00:00.000Z",
    "tweet": "https://pbs.twimg.com/media/E-llpJ1XMAEN3Y3.jpg:large",
    "land": [
      {
        "temtem": "Chubee",
        "areas": [
          "Hills"
        ],
        "ratePercent": 80,
        "lumaRate": 1,
        "minSvs": 29,
        "eggTechPercent": 7
      }
    ],
    "water": [
      {
        "temtem": "Umishi",
        "areas": [
          "Water"
        ],
        "ratePercent": 100,
        "lumaRate": 1,
        "minSvs": 33,
        "eggTechPercent": 10
      }
    ]
  },
  {
    "dateRange": "Aug 30th to Sep 5th 2021",
    "startDateFormatted": "30/08/2021",
    "endDateFormatted": "05/09/2021",
    "startDate": "2021-08-30T00:00:00.000Z",
    "endDate": "2021-09-05T00:00:00.000Z",
    "tweet": "https://pbs.twimg.com/media/E-BiaVCXoAYQvAt?format=jpg&name=4096x4096",
    "land": [
      {
        "temtem": "Halzhi",
        "areas": [
          "Fields"
        ],
        "ratePercent": 70,
        "lumaRate": 4,
        "minSvs": 0,
        "eggTechPercent": 13
      },
      {
        "temtem": "Pycko",
        "areas": [
          "Caves"
        ],
        "ratePercent": 65,
        "lumaRate": 3,
        "minSvs": 0,
        "eggTechPercent": 5
      }
    ],
    "water": []
  },
  {
    "dateRange": "Aug 23rd to Aug 29th 2021",
    "startDateFormatted": "23/08/2021",
    "endDateFormatted": "29/08/2021",
    "startDate": "2021-08-23T00:00:00.000Z",
    "endDate": "2021-08-29T00:00:00.000Z",
    "tweet": "/wiki/File:SaiparkWeek23-28Aug2021.jpg",
    "land": [
      {
        "temtem": "Galvanid",
        "areas": [
          "Hills"
        ],
        "ratePercent": 40,
        "lumaRate": 1,
        "minSvs": 26,
        "eggTechPercent": 3
      },
      {
        "temtem": "Hoglip",
        "areas": [
          "Fields"
        ],
        "ratePercent": 75,
        "lumaRate": 1,
        "minSvs": 27,
        "eggTechPercent": 8
      }
    ],
    "water": []
  },
  {
    "dateRange": "Aug 16th to Aug 22nd 2021",
    "startDateFormatted": "16/08/2021",
    "endDateFormatted": "22/08/2021",
    "startDate": "2021-08-16T00:00:00.000Z",
    "endDate": "2021-08-22T00:00:00.000Z",
    "tweet": "https://pbs.twimg.com/media/E85b4rVWQAE4gi6.jpg:large",
    "land": [
      {
        "temtem": "Adoroboros",
        "areas": [
          "Fields"
        ],
        "ratePercent": 20,
        "lumaRate": 6,
        "minSvs": 0,
        "eggTechPercent": 10
      },
      {
        "temtem": "Magmis",
        "areas": [
          "Caves"
        ],
        "ratePercent": 100,
        "lumaRate": 3,
        "minSvs": 0,
        "eggTechPercent": 0
      }
    ],
    "water": []
  },
  {
    "dateRange": "Aug 9th to Aug 15th 2021",
    "startDateFormatted": "09/08/2021",
    "endDateFormatted": "15/08/2021",
    "startDate": "2021-08-09T00:00:00.000Z",
    "endDate": "2021-08-15T00:00:00.000Z",
    "tweet": "https://pbs.twimg.com/media/E8VYoAUWYAAmASM?format=jpg&name=4096x4096",
    "land": [
      {
        "temtem": "0b1",
        "areas": [
          "Fields"
        ],
        "ratePercent": 90,
        "lumaRate": 1,
        "minSvs": 28,
        "eggTechPercent": 10
      },
      {
        "temtem": "Mushi",
        "areas": [
          "Caves"
        ],
        "ratePercent": 80,
        "lumaRate": 1,
        "minSvs": 29,
        "eggTechPercent": 10
      }
    ],
    "water": []
  },
  {
    "dateRange": "Aug 2nd to Aug 8th 2021",
    "startDateFormatted": "02/08/2021",
    "endDateFormatted": "08/08/2021",
    "startDate": "2021-08-02T00:00:00.000Z",
    "endDate": "2021-08-08T00:00:00.000Z",
    "tweet": "https://pbs.twimg.com/media/E7xVsGbWYAI7ZVx.jpg:large",
    "land": [
      {
        "temtem": "Smolzy",
        "areas": [
          "Caves"
        ],
        "ratePercent": 65,
        "lumaRate": 3,
        "minSvs": 0,
        "eggTechPercent": 10
      },
      {
        "temtem": "Hidody",
        "areas": [
          "Fields"
        ],
        "ratePercent": 75,
        "lumaRate": 4,
        "minSvs": 0,
        "eggTechPercent": 15
      }
    ],
    "water": []
  },
  {
    "dateRange": "Jul 26th to Aug 1st 2021",
    "startDateFormatted": "26/07/2021",
    "endDateFormatted": "01/08/2021",
    "startDate": "2021-07-26T00:00:00.000Z",
    "endDate": "2021-08-01T00:00:00.000Z",
    "tweet": "https://pbs.twimg.com/media/E7NSmRuXIAE728C.jpg:large",
    "land": [
      {
        "temtem": "Ampling",
        "areas": [
          "Hills"
        ],
        "ratePercent": 70,
        "lumaRate": 1,
        "minSvs": 29,
        "eggTechPercent": 10
      }
    ],
    "water": [
      {
        "temtem": "Fomu",
        "areas": [
          "Water"
        ],
        "ratePercent": 100,
        "lumaRate": 1,
        "minSvs": 27,
        "eggTechPercent": 10
      }
    ]
  },
  {
    "dateRange": "Jul 19th to Jul 25th 2021",
    "startDateFormatted": "19/07/2021",
    "endDateFormatted": "25/07/2021",
    "startDate": "2021-07-19T00:00:00.000Z",
    "endDate": "2021-07-25T00:00:00.000Z",
    "tweet": "https://pbs.twimg.com/media/E6pPYSIXIAMNzn9.jpg:large",
    "land": [
      {
        "temtem": "Momo",
        "areas": [
          "Hills"
        ],
        "ratePercent": 75,
        "lumaRate": 3,
        "minSvs": 0,
        "eggTechPercent": 0
      },
      {
        "temtem": "Oree",
        "areas": [
          "Fields"
        ],
        "ratePercent": 85,
        "lumaRate": 3,
        "minSvs": 0,
        "eggTechPercent": 10
      }
    ],
    "water": []
  },
  {
    "dateRange": "Jul 12th to Jul 18th 2021",
    "startDateFormatted": "12/07/2021",
    "endDateFormatted": "18/07/2021",
    "startDate": "2021-07-12T00:00:00.000Z",
    "endDate": "2021-07-18T00:00:00.000Z",
    "tweet": "https://pbs.twimg.com/media/E6FM2XaWEAMAGHy.jpg:large",
    "land": [
      {
        "temtem": "Mimit",
        "areas": [
          "Fields"
        ],
        "ratePercent": 75,
        "lumaRate": 1,
        "minSvs": 29,
        "eggTechPercent": 0
      },
      {
        "temtem": "Saipat",
        "areas": [
          "Caves"
        ],
        "ratePercent": 85,
        "lumaRate": 1,
        "minSvs": 26,
        "eggTechPercent": 15
      }
    ],
    "water": []
  },
  {
    "dateRange": "Jul 5th to Jul 11th 2021",
    "startDateFormatted": "05/07/2021",
    "endDateFormatted": "11/07/2021",
    "startDate": "2021-07-05T00:00:00.000Z",
    "endDate": "2021-07-11T00:00:00.000Z",
    "tweet": "https://pbs.twimg.com/media/E5hJVckX0AQJ9wH.jpg:large",
    "land": [
      {
        "temtem": "Blooze",
        "areas": [
          "Caves"
        ],
        "ratePercent": 100,
        "lumaRate": 3,
        "minSvs": 0,
        "eggTechPercent": 15
      },
      {
        "temtem": "Chromeon",
        "areas": [
          "Fields"
        ],
        "ratePercent": 80,
        "lumaRate": 3,
        "minSvs": 0,
        "eggTechPercent": 0
      }
    ],
    "water": []
  },
  {
    "dateRange": "Jun 20th to Jul 4th 2021",
    "startDateFormatted": "20/06/2021",
    "endDateFormatted": "04/07/2021",
    "startDate": "2021-06-20T00:00:00.000Z",
    "endDate": "2021-07-04T00:00:00.000Z",
    "tweet": "https://pbs.twimg.com/media/E49GARHWUAI39v5.jpg:large",
    "land": [
      {
        "temtem": "Tateru",
        "areas": [
          "Caves"
        ],
        "ratePercent": 100,
        "lumaRate": 1,
        "minSvs": 29,
        "eggTechPercent": 20
      },
      {
        "temtem": "Smolzy",
        "areas": [
          "Hills"
        ],
        "ratePercent": 70,
        "lumaRate": 1,
        "minSvs": 26,
        "eggTechPercent": 20
      }
    ],
    "water": []
  },
  {
    "dateRange": "Jun 21st to Jun 27th 2021",
    "startDateFormatted": "21/06/2021",
    "endDateFormatted": "27/06/2021",
    "startDate": "2021-06-21T00:00:00.000Z",
    "endDate": "2021-06-27T00:00:00.000Z",
    "tweet": "https://pbs.twimg.com/media/E4ZC-4IWYAAiWqX.jpg:large",
    "land": [
      {
        "temtem": "Paharo",
        "areas": [
          "Hills"
        ],
        "ratePercent": 80,
        "lumaRate": 4,
        "minSvs": 0,
        "eggTechPercent": 12
      },
      {
        "temtem": "Scarawatt",
        "areas": [
          "Caves"
        ],
        "ratePercent": 85,
        "lumaRate": 4,
        "minSvs": 0,
        "eggTechPercent": 12
      }
    ],
    "water": []
  },
  {
    "dateRange": "Jun 14th to Jun 20th 2021",
    "startDateFormatted": "14/06/2021",
    "endDateFormatted": "20/06/2021",
    "startDate": "2021-06-14T00:00:00.000Z",
    "endDate": "2021-06-20T00:00:00.000Z",
    "tweet": "https://pbs.twimg.com/media/E31AqXWXMAAgua6.jpg:large",
    "land": [
      {
        "temtem": "Cycrox",
        "areas": [
          "Fields"
        ],
        "ratePercent": 70,
        "lumaRate": 1,
        "minSvs": 28,
        "eggTechPercent": 10
      }
    ],
    "water": [
      {
        "temtem": "Platypet",
        "areas": [
          "Water"
        ],
        "ratePercent": 100,
        "lumaRate": 1,
        "minSvs": 28,
        "eggTechPercent": 10
      }
    ]
  },
  {
    "dateRange": "Jun 7th to Jun 13th 2021",
    "startDateFormatted": "07/06/2021",
    "endDateFormatted": "13/06/2021",
    "startDate": "2021-06-07T00:00:00.000Z",
    "endDate": "2021-06-13T00:00:00.000Z",
    "tweet": "https://pbs.twimg.com/media/E3Q8wKLXMAADhoZ.jpg:large",
    "land": [
      {
        "temtem": "Raiber",
        "areas": [
          "Fields"
        ],
        "ratePercent": 60,
        "lumaRate": 4,
        "minSvs": 0,
        "eggTechPercent": 20
      }
    ],
    "water": []
  },
  {
    "dateRange": "May 31st to Jun 6th 2021",
    "startDateFormatted": "31/05/2021",
    "endDateFormatted": "06/06/2021",
    "startDate": "2021-05-31T00:00:00.000Z",
    "endDate": "2021-06-06T00:00:00.000Z",
    "tweet": "https://pbs.twimg.com/media/E2s6caVWEAUJnSD.jpg:large",
    "land": [
      {
        "temtem": "Oree",
        "areas": [
          "Hills"
        ],
        "ratePercent": 80,
        "lumaRate": 1,
        "minSvs": 27,
        "eggTechPercent": 10
      },
      {
        "temtem": "Skail",
        "areas": [
          "Caves"
        ],
        "ratePercent": 100,
        "lumaRate": 1,
        "minSvs": 30,
        "eggTechPercent": 10
      }
    ],
    "water": []
  },
  {
    "dateRange": "May 24th to May 30th 2021",
    "startDateFormatted": "24/05/2021",
    "endDateFormatted": "30/05/2021",
    "startDate": "2021-05-24T00:00:00.000Z",
    "endDate": "2021-05-30T00:00:00.000Z",
    "tweet": "https://pbs.twimg.com/media/E2I1bZaXIAAonPr.jpg:large",
    "land": [
      {
        "temtem": "Galvanid",
        "areas": [
          "Caves"
        ],
        "ratePercent": 50,
        "lumaRate": 3,
        "minSvs": 0,
        "eggTechPercent": 15
      },
      {
        "temtem": "Paharo",
        "areas": [
          "Hills"
        ],
        "ratePercent": 100,
        "lumaRate": 3,
        "minSvs": 0,
        "eggTechPercent": 15
      }
    ],
    "water": []
  },
  {
    "dateRange": "May 11th to May 17th 2020",
    "startDateFormatted": "11/05/2020",
    "endDateFormatted": "17/05/2020",
    "startDate": "2020-05-11T00:00:00.000Z",
    "endDate": "2020-05-17T23:59:59.999Z",
    "tweet": "https://pbs.twimg.com/media/E1kzdy8WQAMfex2?format=jpg&name=4096x4096",
    "land": [
      {
        "temtem": "Banapi",
        "areas": [
          "Hills"
        ],
        "ratePercent": 80,
        "lumaRate": 1,
        "minSvs": 27,
        "eggTechPercent": 10
      },
      {
        "temtem": "Halzhi",
        "areas": [
          "Fields"
        ],
        "ratePercent": 80,
        "lumaRate": 1,
        "minSvs": 26,
        "eggTechPercent": 10
      }
    ],
    "water": []
  },
  {
    "dateRange": "May 4th to May 10th 2020",
    "startDateFormatted": "04/05/2020",
    "endDateFormatted": "10/05/2020",
    "startDate": "2020-05-04T00:00:00.000Z",
    "endDate": "2020-05-10T23:59:59.999Z",
    "tweet": "https://pbs.twimg.com/media/E1AwNsqWQAAZp8u?format=jpg&name=4096x4096",
    "land": [],
    "water": [
      {
        "temtem": "Pewki",
        "areas": [
          "Water"
        ],
        "ratePercent": 100,
        "lumaRate": 4,
        "minSvs": 0,
        "eggTechPercent": 15
      }
    ]
  },
  {
    "dateRange": "May 4th to May 10th 2020",
    "startDateFormatted": "04/05/2020",
    "endDateFormatted": "10/05/2020",
    "startDate": "2020-05-04T00:00:00.000Z",
    "endDate": "2020-05-10T23:59:59.999Z",
    "tweet": "https://pbs.twimg.com/media/E1AwNsqWQAAZp8u?format=jpg&name=4096x4096",
    "land": [
      {
        "temtem": "Hoglip",
        "areas": [
          "Hills"
        ],
        "ratePercent": 90,
        "lumaRate": 3,
        "minSvs": 0,
        "eggTechPercent": 10
      }
    ],
    "water": []
  },
  {
    "dateRange": "Apr 27th to May 3rd 2020",
    "startDateFormatted": "27/04/2020",
    "endDateFormatted": "03/05/2020",
    "startDate": "2020-04-27T00:00:00.000Z",
    "endDate": "2020-05-03T23:59:59.999Z",
    "tweet": "https://pbs.twimg.com/media/E0ctTbtXoAE_Zw3?format=jpg&name=4096x4096",
    "land": [
      {
        "temtem": "Vulvir",
        "areas": [
          "Caves"
        ],
        "ratePercent": 100,
        "lumaRate": 1,
        "minSvs": 30,
        "eggTechPercent": 10
      },
      {
        "temtem": "Scarawatt",
        "areas": [
          "Fields"
        ],
        "ratePercent": 100,
        "lumaRate": 1,
        "minSvs": 30,
        "eggTechPercent": 10
      }
    ],
    "water": []
  },
  {
    "dateRange": "Apr 20th to Apr 26th 2020",
    "startDateFormatted": "20/04/2020",
    "endDateFormatted": "26/04/2020",
    "startDate": "2020-04-20T00:00:00.000Z",
    "endDate": "2020-04-26T23:59:59.999Z",
    "tweet": "https://pbs.twimg.com/media/E0ctTbtXoAE_Zw3?format=jpg&name=4096x4096",
    "land": [
      {
        "temtem": "0b1",
        "areas": [
          "Fields"
        ],
        "ratePercent": 90,
        "lumaRate": 3,
        "minSvs": 0,
        "eggTechPercent": 15
      },
      {
        "temtem": "Ampling",
        "areas": [
          "Hills"
        ],
        "ratePercent": 100,
        "lumaRate": 3,
        "minSvs": 0,
        "eggTechPercent": 15
      }
    ],
    "water": []
  },
  {
    "dateRange": "Apr 13th to Apr 19th 2020",
    "startDateFormatted": "13/04/2020",
    "endDateFormatted": "19/04/2020",
    "startDate": "2020-04-13T00:00:00.000Z",
    "endDate": "2020-04-19T23:59:59.999Z",
    "tweet": "https://pbs.twimg.com/media/EzUnVbbUYAUzdZ2?format=jpg&name=4096x4096",
    "land": [
      {
        "temtem": "Pigepic",
        "areas": [
          "Hills"
        ],
        "ratePercent": 100,
        "lumaRate": 1,
        "minSvs": 39,
        "eggTechPercent": 10
      }
    ],
    "water": [
      {
        "temtem": "Koish",
        "areas": [
          "Water"
        ],
        "ratePercent": 100,
        "lumaRate": 1,
        "minSvs": 33,
        "eggTechPercent": 0
      }
    ]
  },
  {
    "dateRange": "Apr 6th to Apr 12th 2020",
    "startDateFormatted": "06/04/2020",
    "endDateFormatted": "12/04/2020",
    "startDate": "2020-04-06T00:00:00.000Z",
    "endDate": "2020-04-12T23:59:59.999Z",
    "tweet": "https://pbs.twimg.com/media/EywkAryWgAA93ns?format=jpg&name=4096x4096",
    "land": [
      {
        "temtem": "Toxolotl",
        "areas": [
          "Caves"
        ],
        "ratePercent": 100,
        "lumaRate": 3,
        "minSvs": 0,
        "eggTechPercent": 20
      },
      {
        "temtem": "Spriole",
        "areas": [
          "Fields"
        ],
        "ratePercent": 100,
        "lumaRate": 4,
        "minSvs": 0,
        "eggTechPercent": 5
      }
    ],
    "water": []
  },
  {
    "dateRange": "Apr 5th to Apr 11th 2021",
    "startDateFormatted": "05/04/2021",
    "endDateFormatted": "11/04/2021",
    "startDate": "2021-04-05T00:00:00.000Z",
    "endDate": "2021-04-11T00:00:00.000Z",
    "tweet": "https://pbs.twimg.com/media/EyMhqAmXAAADq4u.jpg:large",
    "land": [
      {
        "temtem": "Akranox",
        "areas": [
          "Hills"
        ],
        "ratePercent": 100,
        "lumaRate": 1,
        "minSvs": 27,
        "eggTechPercent": 10
      },
      {
        "temtem": "Occlura",
        "areas": [
          "Caves"
        ],
        "ratePercent": 85,
        "lumaRate": 1,
        "minSvs": 26,
        "eggTechPercent": 12
      }
    ],
    "water": []
  },
  {
    "dateRange": "Mar 29th to Apr 4th 2021",
    "startDateFormatted": "29/03/2021",
    "endDateFormatted": "04/04/2021",
    "startDate": "2021-03-29T00:00:00.000Z",
    "endDate": "2021-04-04T00:00:00.000Z",
    "tweet": "https://pbs.twimg.com/media/ExoddU4WUAIz31y.jpg:large",
    "land": [
      {
        "temtem": "Lapinite",
        "areas": [
          "Caves"
        ],
        "ratePercent": 100,
        "lumaRate": 3,
        "minSvs": 0,
        "eggTechPercent": 15
      },
      {
        "temtem": "Mushi",
        "areas": [
          "Fields"
        ],
        "ratePercent": 80,
        "lumaRate": 3,
        "minSvs": 0,
        "eggTechPercent": 15
      }
    ],
    "water": []
  },
  {
    "dateRange": "Mar 22nd to Mar 28th 2021",
    "startDateFormatted": "22/03/2021",
    "endDateFormatted": "28/03/2021",
    "startDate": "2021-03-22T00:00:00.000Z",
    "endDate": "2021-03-28T00:00:00.000Z",
    "tweet": "https://pbs.twimg.com/media/ExEa8EiWUAAOmer.jpg:large",
    "land": [
      {
        "temtem": "Kaku",
        "areas": [
          "Hills"
        ],
        "ratePercent": 100,
        "lumaRate": 1,
        "minSvs": 28,
        "eggTechPercent": 10
      },
      {
        "temtem": "Swali",
        "areas": [
          "Fields"
        ],
        "ratePercent": 100,
        "lumaRate": 1,
        "minSvs": 28,
        "eggTechPercent": 10
      }
    ],
    "water": []
  },
  {
    "dateRange": "Mar 15th to Mar 21st 2021",
    "startDateFormatted": "15/03/2021",
    "endDateFormatted": "21/03/2021",
    "startDate": "2021-03-15T00:00:00.000Z",
    "endDate": "2021-03-21T00:00:00.000Z",
    "tweet": "https://pbs.twimg.com/media/EwgXNRnWYAImfqU.jpg:large",
    "land": [
      {
        "temtem": "Vulffy",
        "areas": [
          "Hills"
        ],
        "ratePercent": 65,
        "lumaRate": 4,
        "minSvs": 0,
        "eggTechPercent": 0
      },
      {
        "temtem": "Osuchi",
        "areas": [
          "Caves"
        ],
        "ratePercent": 60,
        "lumaRate": 4,
        "minSvs": 0,
        "eggTechPercent": 15
      }
    ],
    "water": []
  },
  {
    "dateRange": "Mar 8th to Mar 14th 2021",
    "startDateFormatted": "08/03/2021",
    "endDateFormatted": "14/03/2021",
    "startDate": "2021-03-08T00:00:00.000Z",
    "endDate": "2021-03-14T00:00:00.000Z",
    "tweet": "https://pbs.twimg.com/media/Ev8UAp7XEAAao1l?format=jpg&name=4096x4096",
    "land": [
      {
        "temtem": "Momo",
        "areas": [
          "Hills"
        ],
        "ratePercent": 100,
        "lumaRate": 1,
        "minSvs": 28,
        "eggTechPercent": 0
      },
      {
        "temtem": "Orphyll",
        "areas": [
          "Fields"
        ],
        "ratePercent": 100,
        "lumaRate": 1,
        "minSvs": 26,
        "eggTechPercent": 10
      }
    ],
    "water": []
  },
  {
    "dateRange": "Feb 24th to Mar 1st 2020",
    "startDateFormatted": "24/02/2020",
    "endDateFormatted": "01/03/2020",
    "startDate": "2020-02-24T00:00:00.000Z",
    "endDate": "2020-03-01T23:59:59.999Z",
    "tweet": "https://pbs.twimg.com/media/EvYRRUUXIAUOP6J.jpg:large",
    "land": [
      {
        "temtem": "Grumvel",
        "areas": [
          "Caves"
        ],
        "ratePercent": 75,
        "lumaRate": 4,
        "minSvs": 0,
        "eggTechPercent": 15
      }
    ],
    "water": [
      {
        "temtem": "Droply",
        "areas": [
          "Water"
        ],
        "ratePercent": 80,
        "lumaRate": 4,
        "minSvs": 0,
        "eggTechPercent": 15
      }
    ]
  },
  {
    "dateRange": "Feb 17th to Feb 23rd 2020",
    "startDateFormatted": "17/02/2020",
    "endDateFormatted": "23/02/2020",
    "startDate": "2020-02-17T00:00:00.000Z",
    "endDate": "2020-02-23T23:59:59.999Z",
    "tweet": "https://pbs.twimg.com/media/Eu0OVaLXYAURWiR?format=jpg&name=4096x4096",
    "land": [
      {
        "temtem": "Kuri",
        "areas": [
          "Caves"
        ],
        "ratePercent": 100,
        "lumaRate": 1,
        "minSvs": 28,
        "eggTechPercent": 0
      },
      {
        "temtem": "Ganki",
        "areas": [
          "Hills"
        ],
        "ratePercent": 100,
        "lumaRate": 1,
        "minSvs": 25,
        "eggTechPercent": 10
      }
    ],
    "water": []
  },
  {
    "dateRange": "Feb 10th to Feb 16th 2020",
    "startDateFormatted": "10/02/2020",
    "endDateFormatted": "16/02/2020",
    "startDate": "2020-02-10T00:00:00.000Z",
    "endDate": "2020-02-16T23:59:59.999Z",
    "tweet": "https://pbs.twimg.com/media/EuQKw04XUAUTCS9?format=jpg&name=4096x4096",
    "land": [
      {
        "temtem": "Bunbun",
        "areas": [
          "Fields"
        ],
        "ratePercent": 70,
        "lumaRate": 4,
        "minSvs": 0,
        "eggTechPercent": 20
      }
    ],
    "water": [
      {
        "temtem": "Umishi",
        "areas": [
          "Water"
        ],
        "ratePercent": 80,
        "lumaRate": 4,
        "minSvs": 0,
        "eggTechPercent": 20
      }
    ]
  },
  {
    "dateRange": "Feb 3rd to Feb 9th 2020",
    "startDateFormatted": "03/02/2020",
    "endDateFormatted": "09/02/2020",
    "startDate": "2020-02-03T00:00:00.000Z",
    "endDate": "2020-02-09T23:59:59.999Z",
    "tweet": "https://pbs.twimg.com/media/EtsHbyfWgAEKs9x?format=jpg&name=4096x4096",
    "land": [
      {
        "temtem": "Zephyruff",
        "areas": [
          "Hills"
        ],
        "ratePercent": 80,
        "lumaRate": 1,
        "minSvs": 30,
        "eggTechPercent": 10
      }
    ],
    "water": [
      {
        "temtem": "Bigu",
        "areas": [
          "Water"
        ],
        "ratePercent": 80,
        "lumaRate": 1,
        "minSvs": 26,
        "eggTechPercent": 10
      }
    ]
  },
  {
    "dateRange": "Jan 27th to Feb 2nd 2020",
    "startDateFormatted": "27/01/2020",
    "endDateFormatted": "02/02/2020",
    "startDate": "2020-01-27T00:00:00.000Z",
    "endDate": "2020-02-02T23:59:59.999Z",
    "tweet": "https://pbs.twimg.com/media/EtIFm6YW4AAJATy?format=jpg&name=large",
    "land": [
      {
        "temtem": "Zizare",
        "areas": [
          "Caves"
        ],
        "ratePercent": 60,
        "lumaRate": 3,
        "minSvs": 0,
        "eggTechPercent": 10
      },
      {
        "temtem": "Kaku",
        "areas": [
          "Fields"
        ],
        "ratePercent": 80,
        "lumaRate": 4,
        "minSvs": 0,
        "eggTechPercent": 15
      }
    ],
    "water": []
  },
  {
    "dateRange": "Jan 20th to Jan 26th 2020",
    "startDateFormatted": "20/01/2020",
    "endDateFormatted": "26/01/2020",
    "startDate": "2020-01-20T00:00:00.000Z",
    "endDate": "2020-01-26T23:59:59.999Z",
    "tweet": "https://pbs.twimg.com/media/EskBj2cXAAAy_ye?format=png&name=900x900",
    "land": [
      {
        "temtem": "Goty",
        "areas": [
          "Hills"
        ],
        "ratePercent": 80,
        "lumaRate": 1,
        "minSvs": 28,
        "eggTechPercent": 10
      }
    ],
    "water": []
  },
  {
    "dateRange": "Jan 13th to Jan 19th 2020",
    "startDateFormatted": "13/01/2020",
    "endDateFormatted": "19/01/2020",
    "startDate": "2020-01-13T00:00:00.000Z",
    "endDate": "2020-01-19T23:59:59.999Z",
    "tweet": "https://pbs.twimg.com/media/Er__zMLW8AUKniG?format=png&name=900x900",
    "land": [
      {
        "temtem": "Swali",
        "areas": [
          "Fields"
        ],
        "ratePercent": 80,
        "lumaRate": 4,
        "minSvs": 0,
        "eggTechPercent": 10
      },
      {
        "temtem": "Hidody",
        "areas": [
          "Hills"
        ],
        "ratePercent": 80,
        "lumaRate": 4,
        "minSvs": 0,
        "eggTechPercent": 10
      }
    ],
    "water": []
  },
  {
    "dateRange": "Jan 6th to Jan 12th 2020",
    "startDateFormatted": "06/01/2020",
    "endDateFormatted": "12/01/2020",
    "startDate": "2020-01-06T00:00:00.000Z",
    "endDate": "2020-01-12T23:59:59.999Z",
    "tweet": "https://i.imgur.com/fsFvxo8.png",
    "land": [
      {
        "temtem": "Spriole",
        "areas": [
          "Fields"
        ],
        "ratePercent": 100,
        "lumaRate": 1,
        "minSvs": 26,
        "eggTechPercent": 10
      },
      {
        "temtem": "Blooze",
        "areas": [
          "Caves"
        ],
        "ratePercent": 100,
        "lumaRate": 1,
        "minSvs": 23,
        "eggTechPercent": 10
      }
    ],
    "water": []
  },
  {
    "dateRange": "Dec 30th 2019 to Jan 5th 2020",
    "startDateFormatted": "30/12/2019",
    "endDateFormatted": "05/01/2020",
    "startDate": "2019-12-30T00:00:00.000Z",
    "endDate": "2020-01-05T23:59:59.999Z",
    "tweet": "https://i.imgur.com/w8Qk445.png",
    "land": [
      {
        "temtem": "Tateru",
        "areas": [
          "Hills"
        ],
        "ratePercent": 100,
        "lumaRate": 3,
        "minSvs": 0,
        "eggTechPercent": 15
      }
    ],
    "water": [
      {
        "temtem": "Saipat",
        "areas": [
          "Water"
        ],
        "ratePercent": 100,
        "lumaRate": 3,
        "minSvs": 0,
        "eggTechPercent": 15
      }
    ]
  },
  {
    "dateRange": "Dec 28th 2020 to Jan 3rd 2021",
    "startDateFormatted": "28/12/2020",
    "endDateFormatted": "03/01/2021",
    "startDate": "2020-12-28T00:00:00.000Z",
    "endDate": "2021-01-03T23:59:59.999Z",
    "tweet": "https://i.imgur.com/hYcCjri.png",
    "land": [
      {
        "temtem": "Magmis",
        "areas": [
          "Caves"
        ],
        "ratePercent": 100,
        "lumaRate": 1,
        "minSvs": 25,
        "eggTechPercent": 0
      }
    ],
    "water": [
      {
        "temtem": "Kalazu",
        "areas": [
          "Water"
        ],
        "ratePercent": 100,
        "lumaRate": 1,
        "minSvs": 25,
        "eggTechPercent": 10
      }
    ]
  },
  {
    "dateRange": "Dec 21st to Dec 27th 2020",
    "startDateFormatted": "21/12/2020",
    "endDateFormatted": "27/12/2020",
    "startDate": "2020-12-21T00:00:00.000Z",
    "endDate": "2020-12-27T23:59:59.999Z",
    "tweet": "https://i.imgur.com/K6cp1qY.png",
    "land": [
      {
        "temtem": "Fomu",
        "areas": [
          "Caves"
        ],
        "ratePercent": 100,
        "lumaRate": 3,
        "minSvs": 0,
        "eggTechPercent": 20
      }
    ],
    "water": [
      {
        "temtem": "Koish",
        "areas": [
          "Water"
        ],
        "ratePercent": 100,
        "lumaRate": 4,
        "minSvs": 0,
        "eggTechPercent": 0
      }
    ]
  },
  {
    "dateRange": "Dec 14th to Dec 20th 2020",
    "startDateFormatted": "14/12/2020",
    "endDateFormatted": "20/12/2020",
    "startDate": "2020-12-14T00:00:00.000Z",
    "endDate": "2020-12-20T23:59:59.999Z",
    "tweet": "https://i.imgur.com/WyJBbA9.png",
    "land": [
      {
        "temtem": "Paharo",
        "areas": [
          "Hills"
        ],
        "ratePercent": 100,
        "lumaRate": 1,
        "minSvs": 26,
        "eggTechPercent": 10
      },
      {
        "temtem": "Lapinite",
        "areas": [
          "Fields"
        ],
        "ratePercent": 100,
        "lumaRate": 1,
        "minSvs": 24,
        "eggTechPercent": 10
      }
    ],
    "water": []
  },
  {
    "dateRange": "Dec 7th to Dec 13th 2020",
    "startDateFormatted": "07/12/2020",
    "endDateFormatted": "13/12/2020",
    "startDate": "2020-12-07T00:00:00.000Z",
    "endDate": "2020-12-13T23:59:59.999Z",
    "tweet": "https://i.imgur.com/rc8TQAU.png",
    "land": [
      {
        "temtem": "Banapi",
        "areas": [
          "Fields"
        ],
        "ratePercent": 100,
        "lumaRate": 3,
        "minSvs": 0,
        "eggTechPercent": 10
      }
    ],
    "water": [
      {
        "temtem": "Platypet",
        "areas": [
          "Water"
        ],
        "ratePercent": 100,
        "lumaRate": 3,
        "minSvs": 0,
        "eggTechPercent": 15
      }
    ]
  },
  {
    "dateRange": "Nov 30th to Dec 6th 2020",
    "startDateFormatted": "30/11/2020",
    "endDateFormatted": "06/12/2020",
    "startDate": "2020-11-30T00:00:00.000Z",
    "endDate": "2020-12-06T23:59:59.999Z",
    "tweet": "https://i.imgur.com/1QGxsh8.png",
    "land": [
      {
        "temtem": "Vulffy",
        "areas": [
          "Hills"
        ],
        "ratePercent": 100,
        "lumaRate": 1,
        "minSvs": 28,
        "eggTechPercent": 0
      },
      {
        "temtem": "Raiber",
        "areas": [
          "Fields"
        ],
        "ratePercent": 60,
        "lumaRate": 1,
        "minSvs": 28,
        "eggTechPercent": 10
      }
    ],
    "water": []
  },
  {
    "dateRange": "Nov 23rd to Nov 29th 2020",
    "startDateFormatted": "23/11/2020",
    "endDateFormatted": "29/11/2020",
    "startDate": "2020-11-23T00:00:00.000Z",
    "endDate": "2020-11-29T23:59:59.999Z",
    "tweet": "https://i.imgur.com/ogTKTkd.png",
    "land": [
      {
        "temtem": "Vulvir",
        "areas": [
          "Caves"
        ],
        "ratePercent": 90,
        "lumaRate": 3,
        "minSvs": 0,
        "eggTechPercent": 10
      },
      {
        "temtem": "Akranox",
        "areas": [
          "Fields"
        ],
        "ratePercent": 90,
        "lumaRate": 3,
        "minSvs": 0,
        "eggTechPercent": 10
      }
    ],
    "water": []
  },
  {
    "dateRange": "Nov 16th to Nov 22nd 2020",
    "startDateFormatted": "16/11/2020",
    "endDateFormatted": "22/11/2020",
    "startDate": "2020-11-16T00:00:00.000Z",
    "endDate": "2020-11-22T23:59:59.999Z",
    "tweet": "https://i.imgur.com/lmVH7A6.png",
    "land": [
      {
        "temtem": "Toxolotl",
        "areas": [
          "Caves"
        ],
        "ratePercent": 100,
        "lumaRate": 1,
        "minSvs": 28,
        "eggTechPercent": 10
      }
    ],
    "water": [
      {
        "temtem": "Pewki",
        "areas": [
          "Water"
        ],
        "ratePercent": 90,
        "lumaRate": 1,
        "minSvs": 25,
        "eggTechPercent": 10
      }
    ]
  },
  {
    "dateRange": "Nov 9th to Nov 15th 2020",
    "startDateFormatted": "09/11/2020",
    "endDateFormatted": "15/11/2020",
    "startDate": "2020-11-09T00:00:00.000Z",
    "endDate": "2020-11-15T23:59:59.999Z",
    "tweet": "https://i.imgur.com/AK0iy1F.png",
    "land": [
      {
        "temtem": "Momo",
        "areas": [
          "Hills"
        ],
        "ratePercent": 60,
        "lumaRate": 3,
        "minSvs": 0,
        "eggTechPercent": 0
      },
      {
        "temtem": "Adoroboros",
        "areas": [
          "Caves"
        ],
        "ratePercent": 40,
        "lumaRate": 3,
        "minSvs": 0,
        "eggTechPercent": 0
      }
    ],
    "water": []
  },
  {
    "dateRange": "Nov 2nd to Nov 8th 2020",
    "startDateFormatted": "02/11/2020",
    "endDateFormatted": "08/11/2020",
    "startDate": "2020-11-02T00:00:00.000Z",
    "endDate": "2020-11-08T23:59:59.999Z",
    "tweet": "https://i.imgur.com/aKqUPRN.png",
    "land": [
      {
        "temtem": "Osuchi",
        "areas": [
          "Caves"
        ],
        "ratePercent": 80,
        "lumaRate": 1,
        "minSvs": 28,
        "eggTechPercent": 10
      },
      {
        "temtem": "Bunbun",
        "areas": [
          "Fields"
        ],
        "ratePercent": 80,
        "lumaRate": 1,
        "minSvs": 28,
        "eggTechPercent": 10
      }
    ],
    "water": []
  },
  {
    "dateRange": "Oct 26th to Nov 1st 2020",
    "startDateFormatted": "26/10/2020",
    "endDateFormatted": "01/11/2020",
    "startDate": "2020-10-26T00:00:00.000Z",
    "endDate": "2020-11-01T23:59:59.999Z",
    "tweet": "https://twitter.com/PlayTemtem/status/1320637482128592896",
    "land": [
      {
        "temtem": "Kuri",
        "areas": [
          "Hills"
        ],
        "ratePercent": 50,
        "lumaRate": 4,
        "minSvs": 0,
        "eggTechPercent": 0
      },
      {
        "temtem": "Occlura",
        "areas": [
          "Caves"
        ],
        "ratePercent": 50,
        "lumaRate": 4,
        "minSvs": 0,
        "eggTechPercent": 10
      }
    ],
    "water": []
  },
  {
    "dateRange": "Oct 19th to Oct 25th 2020",
    "startDateFormatted": "19/10/2020",
    "endDateFormatted": "25/10/2020",
    "startDate": "2020-10-19T00:00:00.000Z",
    "endDate": "2020-10-25T23:59:59.999Z",
    "tweet": "https://twitter.com/PlayTemtem/status/1318099964770353154",
    "land": [
      {
        "temtem": "Magmis",
        "areas": [
          "Caves"
        ],
        "ratePercent": 70,
        "lumaRate": 3,
        "minSvs": 0,
        "eggTechPercent": 0
      },
      {
        "temtem": "Orphyll",
        "areas": [
          "Fields"
        ],
        "ratePercent": 60,
        "lumaRate": 3,
        "minSvs": 0,
        "eggTechPercent": 15
      }
    ],
    "water": []
  },
  {
    "dateRange": "Oct 12th to Oct 18th 2020",
